qa maths	let's do math
iot hue lightup	it is too dark in here increase the brightness of the lights
transport traffic	what is the condition of traffic from work to home
iot hue lightup	please increase the light of table lamp
lists createoradd	edit list
calendar query	what is next in my calendar
news query	what's going around in the world these days
audio volume up	turn the sound up
social query	what is the latest from my feed
iot hue lightup	i would like all the lights on when i enter
transport ticket	find me a train ticket next monday to new york city
qa maths	resolve this thirty twelve
qa currency	give me the exchange rate for dollar in euros
calendar remove	change the plan of meeting
iot hue lightdim	bed room two darken
general confirm	did you get the last thing said correctly?
play radio	i want to listen to today's hits
datetime convert	it is ten am in eastern standard time what time it is now it pacific standard time
alarm set	set my calendar for an alarm at five pm tuesday
play radio	tune to pandora
calendar remove	i need to cancel my rsvp for dinner this evening can you remove it on my calendar as well
calendar set	can you remind me of sunday gym every saturday evening
calendar set	can you remind me about the gym class in two hours
qa factoid	wikipedia page about sean connery
qa definition	describe a rotor
qa stock	current price of google please
email query	have i received any emails from beth
lists createoradd	please create a list of due payment those who not received more then ten months
general confirm	check the command.
general praise	i appreciate it, that's great job.
recommendation locations	markets near by
calendar query	what are meeting scheduled for today
calendar query	when will the match start
general dontcare	this is unimportant for me.
qa factoid	what is the financial capital of canada
iot hue lightup	make it brighter
play podcasts	start playing my most played podcast
general confirm	check the last thing said please.
transport query	when indianapolis express will reach indiana
general praise	it's helpful, thank you very much.
recommendation locations	what clothing shops are close to my current location
music settings	cut the songs in this musics
alarm set	make a new alarm
iot cleaning	vacuum the mud room
general dontcare	really would not mind.
qa maths	what is twelve plus one hundred and ninety six
calendar query	do i have any appointments scheduled for march twenty four two thousand and seventeen
qa currency	what would be the exchange rate of currency in japan
email querycontact	select the contact
play podcasts	next one please
music query	what song is playing on windows media player
iot hue lightup	make this room brighter
music query	where can i find this song
alarm set	set alarm for saturday morning soccer practice at eight am
lists query	what is on the list for today
email query	any important notifications
iot cleaning	take it in hand
qa factoid	why did gotse shoot mahatma gandhi
transport query	what is the departure time for the next train leaving new york city
general dontcare	that is unimportant.
calendar set	all rccg march event is to be added to my calendar
qa maths	could you calculate five plus five
cooking recipe	tell how vegetable is cooked
calendar remove	please remove the doctor appointment in my calendar for february twelfth at nine am
music query	i want to know what song has the phrase stairway to heaven in it
play music	i want to hear chopin now
qa maths	solve the calculation
play podcasts	play heavyweight podcast
recommendation locations	what restaurants are open near me
recommendation locations	whats a good place to eat around midtown new york
general dontcare	whatever.
iot hue lightchange	switch lights to dim red
general praise	you are my star, thank you so much, olly.
play music	run indian folk song
qa factoid	how big is the grand canyon
play game	please begin clash of clans
iot hue lightdim	lights down
transport traffic	road traffic
calendar query	do i have a date for tonight
general praise	thank you, olly.
qa currency	convert the american dollar to the euro
calendar remove	erase events
email sendemail	email tom
general commandstop	shut down please.
iot hue lightup	please raise the light i am not comfortable at this
transport query	train departure
calendar query	meetings from twenty to twenty five june
music settings	set track twenty eight in music player on repeat
calendar remove	delete all events in calendar
iot hue lightup	raise the lamp's light
lists createoradd	begin a new list
music query	what's next song on my playlist
lists query	what do i need to pick up at the grocery store
play podcasts	please go to next date
general affirm	that is right.
general commandstop	olly that is enough, just cancel.
general commandstop	can you shut up please.
general affirm	yeah please.
email addcontact	i need to add this new contact for sam smith ssmith@yahoo dot com
iot coffee	get a cup of coffee ready now
cooking recipe	how do i steam rice
cooking recipe	what temperature do you bake a potato
qa currency	give me the exchange rate between united states dollar and japanese yen
email querycontact	what is jeff's number
music settings	loop this track
lists remove	delete the dog list for me
iot hue lightdim	dim the lights in the kitchen
email querycontact	tell me john's phone number
play music	play my country playlist
weather query	how cold is it outside
play music	play me all jazz music
play music	play all songs by martina mcbride
calendar set	please set a reminder for church services on sundays for eleven am
general dontcare	i would not mind to select any one.
datetime convert	it's eight at night in france what time is it in new york
audio volume up	raise volume to level seven on music player
general confirm	please can you confirm last thing said.
social post	please tweet for me about the bad service rended by the taj restaurant
iot cleaning	how do you turn on the robot vacuum cleaner
iot hue lightoff	i want the light to be switched off
iot hue lighton	turn the lights on full bright
calendar query	what have i got going on between three and four pm today
play radio	play my favorite station
recommendation locations	tea shop
general commandstop	please could you shut off.
email sendemail	send an email with the address you gave me to jean saying meet us here at eight pm
iot coffee	make some coffee
news query	i want to know the latest local news of the city
qa definition	what does it mean to be overbearing
play music	play my first favorite song on loop
iot coffee	prepare coffee now
calendar query	show me my events
play radio	let's hear ninety two point one
play game	play rummy
transport query	what times do the trains run between here and the met
qa currency	what is the exchange of euro to dollars
qa factoid	what is elvis favorite ride
social query	what did happen today
play radio	i need you to start fm eight hundred and ninety radio channel
iot coffee	hey can you please make me a creamy coffee
play podcasts	play episode two of the intern
social query	what's trending on twitter
qa definition	what is piramid
general commandstop	olly that's enough, just stop it.
cooking recipe	tell me the recipe for yellow rice
transport ticket	book a train ticket from orlando to chicago
qa definition	look up the word snafu
news query	tell me about current status of sunderland vs liverpool match
lists remove	delete that item from my list
qa factoid	where is italy
weather query	how's the weather today
transport ticket	can you book a train ticket
audio volume down	lower the volume
general confirm	can you confirm what said please.
calendar remove	take lunch meeting off my calendar
transport traffic	whats the traffic like near ypsilanti
qa definition	tell me what the word organism means
iot hue lightdim	turn my lights down to a lower level of brightness
calendar query	when the birthday will be
email sendemail	send an email to adele
music query	what playlist is on shuffle
music query	who is the singer of song
iot coffee	brew my coffee
lists remove	delete out item
play game	start candy crush
news query	what's happening in news express
iot hue lightchange	change my house lights colour to blue
qa currency	what is the us dollar and euro exchange rate
general praise	oh it's nice one.
play game	start play fifa seventeen
recommendation locations	can you tell me a good place to eat
play radio	activate the radio please
email addcontact	add carl's email to my contact
transport ticket	please purchase a amtrak ticket from las vegas nevada to lakeland florida leaving on the first of april
play radio	i'd like to listen to ninety nine point five
lists createoradd	please add new item to list
social post	@nikesupport i need some assistance regarding some shoes i bought last week
calendar query	latest events
music query	what's that the album is current music from
iot hue lightchange	set brightness to fifty percent
calendar query	when is the next office meeting
datetime convert	please change time zone to canada
datetime convert	please change time zone to india
calendar set	give me the list of all events coming up in the next month and set notifications for all of them
qa stock	what is the netflix stock price
transport traffic	how is the traffic in broadway street
email querycontact	what is john's phone number
iot cleaning	start vacuum cleaner now
alarm set	make an alarm for three pm
news query	has anything happened to mass effect
play podcasts	show me the previous episode
qa maths	what is twelve divided by four
general affirm	yes good response to command.
iot hue lightup	make the ceiling lights brighter
qa stock	how much to buy stock in i. b. m.
social post	tweet a complaint to local municipality
music settings	please add this song to work out playlist
qa factoid	how old is barack obaba
iot cleaning	start a vacuum cleaner
play game	i need to play sims
calendar set	add a reminder for april twenty as my bro's birthday
qa stock	refer the stock price of hdfc
email querycontact	is it joes birthday soon
email query	do i have an email from person a
weather query	what will the weather be like on saturday
audio volume up	turn up the volume of my speakers
iot hue lightup	brighten the lights in this room
play podcasts	play favorited podcasts on fishing
email querycontact	please let me know when is sam's birthday
lists query	what lists are available
social query	live show reminders
play music	turn on some music
email sendemail	create an email that needs to go out to my family
lists createoradd	make a new list of dog breeds
iot wemo on	could you please turn on the plug
general affirm	you have done it correcly.
cooking recipe	tell me the best recipes for a given dish
qa factoid	what is the geographic info of a pop singer rahman
datetime convert	change this time zone to washington
lists remove	i'm done with today's to do list
music settings	please lower the shuffle rate of hips don't lie
iot hue lightchange	light settings
social post	announce a comment in facebook
weather query	it seems cold
general commandstop	please shut up.
email querycontact	olly i need to call my mom will you check her work number for me
news query	give me the headlines from sky news
play music	please resume my music
social post	send a tweet to meijer tell them that they have the worst customer service
lists remove	remove my list of notes from last week
calendar set	activate a one week notification before my anniversary please
iot hue lightdim	hi can you please turn lower the lights
iot hue lightup	please set the brightness of lightness appropriately in kitchen
email querycontact	which contact haven't i called in twelve months
iot hue lightoff	turn off this light
general commandstop	that's all, just cancel it.
qa factoid	what are the climatic conditions in that area
weather query	what is the current weather conditions in chicago illinois
calendar remove	update the calendar with the last event removed
qa currency	exchange u. s. d. to g. b. p.
qa stock	please find out the share price of i. b. m. in nasdaq
recommendation locations	where is the closest sweet frog
play radio	play the kansas city hip hop station
email query	check my email
transport query	i would like to know the train timings to bournemouth tomorrow
iot coffee	coffee please
iot hue lightoff	turn off the nearest light to me
play podcasts	play next on podcast
play radio	play radio one
music query	what song is playing right now
play radio	could you please help me in listening to the radio
iot coffee	start making a coffee
general dontcare	any one is good to me.
iot hue lightoff	can you turn my bathroom lights off
social query	in every three hours give me my facebook update
transport ticket	schedule a journey to las vegas by train
calendar remove	remove all the events and schedules
news query	what's happening in the news
qa definition	i need to get the definition of a word massive
play game	turn on flappy bird
iot coffee	how do i set my coffee machine to make coffee
iot hue lightchange	change lights
social query	has mary posted anything to facebook today
audio volume down	low the volume
transport ticket	i need to go to lyon book a train ticket
play game	do a tournament with me in candy crush
qa currency	what's the rate between the u. s. d. and ukraine's currency
lists createoradd	add a movie name to the wish list
transport ticket	book me a train ride covering five destinations to see in new york
qa stock	what's new with the stock market
transport ticket	travel book a train ticket
email addcontact	please add dan's email to my contacts
qa currency	money exchange
social query	are there any updates on facebook
cooking recipe	show me pancakes
general affirm	yes you have got my instructions perfectly.
email sendemail	send an email to my friend say birthday wishes
transport query	how to get somewhere
general commandstop	can you just stop it please.
lists createoradd	i want to have a new playlist of songs
general affirm	you have gotten that exactly.
general affirm	yes wonderful response to command.
iot wemo on	turn on the wemo plug socket to connect my charger to it
qa factoid	Where is miami
alarm set	i need to get up at seven am
transport traffic	how is the traffic right now
calendar set	can you remind me to check my clothes in a hour
qa stock	how much rate will be calculated
qa maths	divide two hundred by four
lists query	read list for me please
qa currency	what is the exchange rate of us dollar today for rupee
play game	my games to play in my computers
play podcasts	next podcast
general praise	that's nice job, thank you so much.
qa maths	what is the square root of ninety seven
iot wemo off	please make the smart socket turn off
weather query	what is the weather like in grand rapids mi
transport ticket	book me a train for the next available train
qa maths	what is the sum of 9 and 12
play music	put classic rock on
recommendation locations	where can i find a good taco truck in los angles
calendar remove	remove meeting for wednesday morning
cooking recipe	tell me how to make garlic bread
qa definition	please tell me the definition of home
calendar remove	erase my appointment for march seven
general affirm	you understood the answer right.
cooking recipe	how to cook this food
music query	when was this song first recorded
email query	how is my inbox looking at the moment
calendar remove	erase my whole calendar
qa stock	look up stock prices for my mutual funds and account
iot wemo on	turn on the wemo plug
music query	what type of music do i enjoy
audio volume down	turn_down speakers
qa maths	how do you solve three two
general confirm	would you check the details please.
iot coffee	make the coffee
iot hue lightup	light up
transport ticket	book a ticket to ny by train
calendar set	please set a monthly reminder for paying rent
cooking recipe	can i get a recipe for tuna
music query	what music is playing now nine hundred and ninety nine fm
lists createoradd	create a list for the following
alarm set	put alarm at five am
iot hue lightup	please make arrangements to make the hall so brighter
audio volume up	more volume please
play radio	play yesterday's hot ninety seven morning show
calendar query	open events this week
play music	will you put on the music
lists query	let me know the list
qa stock	how effective will be to buy nike stock
play radio	tune into ninety nine point five fm
general confirm	please can you check and confirm last thing i said.
calendar remove	please cancel my next hair cut
play music	play the song for me
lists remove	please delete the list
lists query	do i have anything outstanding on any lists
weather query	will i need an umbrella tomorrow
transport traffic	how slow is traffic on the five
play game	i challenge you to a game
iot wemo off	turn off wemo plug in game room
calendar set	add event book club debbie's house wednesday night
weather query	let me know when the next cold front is expected
iot wemo off	please turn socket off
general affirm	wonderful response to command.
iot coffee	please make some coffee for me
general confirm	would you please check my last command.
email querycontact	what's rene phone number
play music	play music for me
music query	when was this song released
transport ticket	i need to go to dundee at five am on sunday by train
qa currency	Show me popular exchange rates
lists createoradd	please put bread on the grocery list
iot hue lightchange	i need to change the color of this light
qa currency	tell me the exchange rate us versus indian rupees
play game	let's roll the dice
email sendemail	hey send an email to my friend
general confirm	i would like you check details please.
social query	what did jeff post on the yard sale page
lists createoradd	start a new list
calendar remove	remove dinner with mike from my calendar
iot hue lightoff	please turn off the lights in the kitchen
social query	open facebook messenger
play podcasts	npr ted talks
transport traffic	traffic please
qa currency	how much is the euro worth versus us dollar
iot wemo off	turn off the wemo plug socket
email sendemail	compose this email to this new email address
qa stock	how are my stocks doing today
qa currency	how much is the euro versus the canadian dollar
iot hue lightoff	good night lights off
calendar query	list out my upcoming events
transport query	how far is walmart from here
qa definition	what's the meaning of rumplestiltskin
recommendation locations	can you tell me about expensive sushi restaurants in west philadelphia
iot hue lightdim	i need to turn the lights down
qa definition	give description of statue of liberty
iot coffee	can you start the coffee
play radio	open fm
transport ticket	book a train ticket for one one way for this tuesday at nine am
calendar remove	please delete this calendar event
iot coffee	brew a pot of coffee
general commandstop	olly please can you shut up.
alarm set	set alarm for tomorrow six am
general affirm	yeah you've got that perfectly.
music query	tell me who wrote this song
play podcasts	start playing podcast about books
qa maths	what is the result of one hundred minus fifty
iot hue lightdim	lower the lights in bedroom two
social post	what is the customer service feedback
general confirm	i like you check question please.
calendar remove	delete my next scheduled event please
qa definition	what does a baguette look like
lists remove	remove the list of person starting from letter m in my contact list
transport query	what time does the last train arrive in dallas
qa currency	how much is the dollar worth compared to the euro
general praise	that's cool,, olly.
qa maths	what is the root of six hundred and twenty five
qa currency	exchange rate of yan with dollar
alarm set	set my alarm for time
iot hue lightdim	dim the lights please
qa stock	what is the difference between yesterday's and today's stock prices for walmart
social query	is there anything exciting on twitter today
lists remove	remove last played song
general dontcare	anything would be fine with me.
transport traffic	what traffic is there on the route to the pittsburgh airport
email querycontact	where does fred work
play music	i want to listen to electric slide
play game	can we play twenty questions
play music	coordinate all pop song genres
calendar remove	delete all events for the next five days
qa stock	which stock markets have lowered in the past three hours
news query	find me any news from so clean the last six hours
play music	i want to hear surfin usa
general praise	you've done it correctly thanks, olly.
social post	tweet a complaint to old navy website
play radio	start radio
email querycontact	provide contact location
calendar remove	remove my car payment on the fifteenth from my calendar
social post	send a complaint to sony about this tv that quit working
lists query	what's on my list
play radio	turn on one oh seven point five
general praise	thanks for asssistance.
lists remove	trash the open list google
general confirm	would you please confirm details.
social post	post the following as a status on facebook
recommendation locations	where is the best pizza on sixth street
news query	read me the most updated news on bbc
lists createoradd	add eggs to list
calendar query	am i free on sunday day
qa factoid	what movies is kevin spacey in
play podcasts	play the next episode of this series
music settings	disable shuffle
general commandstop	that's enough, just cancel it.
lists remove	take item off list
lists query	tell me what is on my list
qa currency	check currencies
play radio	please turn on radio on seven am
social post	write a tweet to burger king expressing my disapproval
play music	go to youtube and play me the best wedding songs collection
play music	let's hear some indie rock okay
email sendemail	reply to erins email by saying i will be on time
iot wemo off	turn off my wemo plug socket now
calendar set	set a notification on third march about company meeting
iot hue lighton	It's too dark in here
iot hue lightoff	turn off bedroom light at nine thirty pm
transport ticket	book for me a train ticket to washingdon dc
lists createoradd	create list
iot coffee	please make a coffee
lists remove	the list should not contain all food items with the prefix dry
recommendation locations	list of the nearby restaurant
iot hue lightdim	reduce light intensity
general confirm	please can you confirm it.
email sendemail	send this email to reply to the latest emails
alarm set	set an alarm for me for tomorrow
alarm set	can you set an alarm for seven am
play game	Please play this game
iot hue lightdim	color of light should be dimmed bright
qa factoid	why are whales big
social query	any new facebook posts from amy
lists createoradd	add toothpaste to my shopping list
transport query	train schedule
transport query	what times may i travel to location a
email querycontact	can you provide me with the contact information assigned to this person
general commandstop	will you just stop please.
play game	play i spy with me
general praise	well done, musch appreciated.
general affirm	confirmed.
qa factoid	is it true the gym is seven miles away
iot cleaning	is there anything i need to know before i activate the robot vacuum cleaner
play radio	i want to hear this week's midweek motorsport
qa currency	currency exchange
iot coffee	make me a capuccino
email query	have i received any emails from my father
general affirm	great response to command.
iot hue lightchange	turn the lights to red color
lists remove	erase my grocery list
calendar query	open my calendar
play podcasts	show me the top rated podcasts
social post	please send a complaint to someone
iot hue lightchange	can the lights be changed to green
iot cleaning	please set the vacuum to start going now
iot hue lightchange	house can you make all the lights in the house blue
play radio	play radio station
iot hue lighton	and the light began
calendar set	set meeting with the ceo tomorrow
qa maths	please solve this math
calendar set	remind me of meeting five minutes before time
general dontcare	any one will be ok for me.
iot hue lightchange	can you do me a favor my eyes are feeling strained on these lights can you please change it to a cooler tone
qa maths	one plus two equal
general dontcare	that does not matter.
general affirm	yes correct response.
transport traffic	how is the traffic around city center
iot coffee	let me get a cup of coffee please
general praise	that's helpful, thank you very much.
qa stock	what's the stock of apple
iot hue lightup	brighten the lights in the hallway
iot hue lightchange	set lights to twenty percent
social query	may i know what is trending in social media
general praise	you are my hero, appreciated.
play game	start up bejeweled
calendar set	remind me off about my tomorrow meeting sharply at ten
play game	play for me the game temple run
weather query	shall i change my car tyres to snow tyres soon
transport traffic	what is the traffic condition of florida
general commandstop	olly that would be all.
audio volume up	make sound louder
qa currency	how much is ten dollars in euros
qa currency	convert one euros to us dollars
general praise	ah it's great work.
transport ticket	book me a train ticket in any train to bombay for tomorrow
iot hue lightchange	make the lights pink at the house
calendar query	where is the event today
email query	are there new emails for me
qa currency	what is the exchange rate between the dollar and the euro currently
lists remove	delete list for groceries
audio volume up	i need to hear sound on my speakers
iot hue lightoff	lights turn off
qa maths	how many miles in five kilometers
qa factoid	is the largest ocean in the world the pacific
social post	send a tweet to kroger about being overcharged for groceries
transport ticket	book ticket to depart in the morning
qa definition	what is the meaning of the word sanctimonious
qa factoid	please tell me about our country latitude and longitude
cooking recipe	is soft cheese better than hard
alarm set	set an alert for two pm
weather query	is it going to snow
iot hue lightup	turn up the brightness
qa definition	what is this thing
email sendemail	start a new email to george brown
qa stock	what is the google stock at
