qa maths	let's do math
general praise	thank you for the response, olly.
social query	tell me what's happening on instagram
iot cleaning	start vacuum cleaner
lists createoradd	add a item
play music	reshuffle and play music
email query	what are my newest emails
qa maths	what is the square root of one hundred and forty eight thousand five hundred and eighty seven
general dontcare	i do not know.
lists query	what is on my playlist of movies on the the dvr
social query	what notifications do i have in social media
lists createoradd	make a things to do list
music query	what artist is singing that song
iot cleaning	have my iroomba clean the house
alarm set	set an alarm at six in the morning
qa factoid	tell me when obama was born
calendar remove	delete lunch tomorrow
qa definition	what does this stitch long sleeved shirt look like
general affirm	yeah exactly.
transport ticket	book a ticket for me on a train to get to boston tomorrow what is available
general confirm	will you please check it.
qa stock	what is the stock price for lexmark
qa currency	exchange rate from cad to u. s. d.
qa factoid	how old is brad pitt
iot cleaning	clean my house
weather query	is it going to rain later
general dontcare	whatever, olly.
play radio	please start the radio
recommendation locations	show shops around second street
lists remove	please remove the list
iot hue lightup	up the brightness on these lights
iot hue lightchange	change the lights to red
qa currency	what is the exchange rate between the us dollar and the aus dollar
recommendation locations	i need to find a gift what stores are within a one mile radius
news query	what news updates are there from news express
play game	open this game
email query	check inbox for mail from sarah
email sendemail	compose a new email to ray
general praise	that's good one, thank you very much.
play radio	can you start ryan seacrest
recommendation locations	is there a sports bar near kansas city plaza area
transport ticket	book a train ticket to new york
lists query	what is that on the list
iot hue lightoff	can you please turn off the lights in this room
play podcasts	please play the next episode
iot hue lightdim	lower the brightness
email query	show me the latest emails from amazon
transport query	can you get me train ticket prices please
audio volume up	please decrease the volume of this song
iot wemo off	i'd like you to shut off my smart plug socket now please
iot hue lighton	and the darkness has fallen
transport ticket	please purchase a train ticket for this weekend
iot cleaning	can you set the vacuum to start cleaning at ten am time
music query	what is the name of this song
recommendation locations	show me all the shops that i can find in milan
email query	check my email messages
music query	what is a good rap album that came out this year
transport ticket	book me a train ticket
iot hue lightoff	turn off room lights
qa currency	what is the dollar price in inr
datetime convert	what time can i call from pennsylvania and it will be business hours in australia
iot coffee	please set my coffee machine to start at four pm time
qa factoid	where do the rocky mountains start
lists query	can i know what i on the list
audio volume down	please turn the volume down
qa factoid	search for pink's youtube channel
email query	what is my recent email activity
iot hue lightoff	turn off the room light
transport traffic	is there any traffic to work
calendar remove	i want you to remove this event
qa definition	the definition of life
news query	i want to know everything that breaks about the dam breaking in california
cooking recipe	learn to cut potatoes correctly
email querycontact	could you get john's email address for me
alarm set	set my alarm for six thirty in the morning tomorrow
email query	is there any new email
iot hue lightchange	pink is all we need
transport query	when i should leave to office
datetime convert	how many hours distance is between my location and new york
transport traffic	in delhi traffic level too high
audio volume up	turn up speakers
iot hue lightchange	change to blue
cooking recipe	what is the cooking time for mashed potatoes
qa maths	what is zero divided by zero
email query	did mike send me an email
social post	please negative response tweet on daikin service
play game	would you like to play never have i ever
iot hue lightoff	make the lights off
calendar query	are there any meetings set for next wednesday
news query	top news
play podcasts	favourite podcast
audio volume down	please speak quieter to me
calendar set	set a reminder on fifteenth march as meeting
iot hue lightdim	lower the light level in my house
play game	i want to play a game with you
iot cleaning	vacuum the house
lists query	what is on my shopping list
iot hue lightchange	make the lights pink
transport query	when is the last train today
general confirm	check and confirm my last command please.
iot hue lightup	turn the lights up
music query	tell me the name of the composer
email query	check email from john
calendar query	do i have a sales meeting today
general confirm	can you please confirm what said.
iot hue lightchange	please change the colour of the lights i'll tell you when to stop
email querycontact	find john smith from alabama
email querycontact	tell me the email address for aunt ruth
social query	is anything trending on social media today
calendar remove	erase calendar events
iot hue lightoff	no lights
transport traffic	tell me the traffic condition from here to home
email sendemail	tell to joe's email that come to my house in this moment i am alone
email querycontact	show me the information of friend
iot wemo on	switch on the plug
email querycontact	what is sarah's number
general affirm	yes you've done command exactly.
qa maths	how do you subtract numbers
news query	what's happening in world news today
qa factoid	what is the size of the united states
calendar query	is there anything i need to be aware of
transport traffic	give details about the current traffic
iot hue lightdim	darken the room a bit
music settings	please check my playlists for jazz music
lists query	what are listed
qa definition	Define economics
play music	play only songs by the beatles please
recommendation locations	find me the oldest hotel in washington dc
lists createoradd	make a new list for me
lists query	how many lists do i have
general dontcare	have no idea about what to do, olly.
news query	what's happening on bbc news today
qa factoid	look up the number of people living in miami florida
general confirm	please confirm details.
qa currency	give me the exchange rate between japanese yen and the australian dollar
transport query	give me the train time
calendar query	what is my next event
iot hue lightoff	please turn off the light in the upstairs bedroom
social query	what are today's highlights from facebook
general dontcare	it is unimportant.
calendar remove	delete an last event reminder of twenty ninth of march twenty seventeen
lists query	any sport event is on my list
social post	tweet a complaint to kohl's customer service
calendar set	please remind me about the event later five pm
lists query	read me back whats on my shopping list
general affirm	answer is confirmed.
audio volume up	i need a high volume
lists createoradd	please add deodorant to my shopping list
audio volume up	i need you to have the volume louder
datetime convert	can you please change the time zone to us
cooking recipe	how can i cook pizza
play radio	radio play nine hundred and eighty nine please
qa currency	find me the exchange rate between dollars and bitcoin
qa stock	give the stock price details of motorolla
news query	breaking news fox news
weather query	is it going to rain on monday
music query	what music is it
calendar query	my events
social post	tweet verizon customer service
calendar set	i have a meeting with sean at four pm on wednesday can you remind me
lists createoradd	produce a new register
play game	get the duet game
iot hue lightdim	lower lights
email query	Check outlook
iot coffee	i cup of joe would be nice right now
qa maths	i need to figure out this percentage
play music	hey play the songs from my playlist named good tunes
play radio	play hot ninety seven
calendar set	create a meeting event in my calendar
cooking recipe	what can i cook with broccoli and chicken
general dontcare	any one will be good to me.
general affirm	yeah great response to command.
play radio	play bbc radio four
qa currency	how much is twenty two usd in euros
qa definition	what is this
iot wemo off	switch off the wemo plug socket
iot coffee	make coffee for me
iot hue lightup	please increase the light
general affirm	yeah fantastic response to the command.
transport traffic	please update me the traffic status
general affirm	yeah you've got my instructions right.
qa stock	send me the stock market updates for today
general dontcare	this is unimportant to me, olly.
lists query	read the list
general dontcare	does not matter for me.
calendar set	add to calendar may two is mary's birthday repeat every year
calendar query	is the balloon festival this weekend
general dontcare	i have no idea regarding to what to do, olly.
weather query	how many degrees is it in orange tx right now
iot coffee	can you get me a cup of coffee
iot wemo on	on mobile charger plug
iot hue lighton	switch on all the lights
music settings	repeat this song three times
lists query	how many items are on my list
qa maths	what is two times two
datetime convert	what is the time difference between india and ivory coast
transport traffic	what are the traffic conditions on the one hundred and one
lists remove	remove item three from the list
transport query	how much is a train ticket to san fransisco
transport traffic	traffic alert
qa maths	what is six minus four
qa currency	display exchange rate of euro to indian rupee
general praise	you have done it right thanks, olly.
transport traffic	please check the traffic to the home
calendar set	write down meeting at seven pm
calendar remove	delete my dr k appointment in march
iot coffee	i want a coffee now
qa stock	what is the highest microsoft stock price today
social post	tweet kohls about the cleanliness of their store
news query	please share up to the minute details on sprint
general confirm	i would like you check and confirm it please.
general dontcare	i do not care.
email sendemail	can you send an email to my mother about the weekly weather
iot coffee	make us a brew
transport query	check time of kalka train from jodhpur station on monday
qa maths	what is the answer to two plus two
play game	do you want to play solitaire
play game	could you harvest the crops in farmvile
general dontcare	i don't really mind for anything.
social post	tweet @wendys that i don't like their product
play game	how about a nice game of chess
news query	get me the latest news of world
news query	fast me the news of academy awards
news query	what's the latest news on donald trump
iot hue lightchange	can this room have green light
general affirm	that is correct.
qa maths	what is the answer to this math question
social query	what was last sent to me in my social media feed
calendar set	schedule a sales meeting for wednesday at eleven am
general praise	you've done that correctly thank you very much.
email query	check mails
iot hue lightdim	reduce the intensity of lights
calendar query	please tell me the main points of my two hundred meeting from this afternoon
audio volume down	decrease the volume to ten
transport traffic	is the road a free way or a toll road
iot hue lightoff	close the light
play game	i want you to play this game for me
general commandstop	olly shut down please.
general commandstop	olly please can you shut off.
calendar query	tell me what is on the schedule for july seventh
calendar set	add a reminder to my calendar every year on this date
weather query	weather this week
qa currency	exchange rate between dollar and mexican peso
cooking recipe	tell me how to cook pasta
transport query	direct me towards nearest railway station
social post	tweet comcast and tell them that their service is down again
general commandstop	olly shut up.
alarm set	alert me at three pm to goto the concert
social query	are there any new snapchats
general commandstop	olly i'd like you just cancel it.
iot cleaning	cleaning is good dust is so bad do now your magic clean my carpet
play radio	i'd like to listen to my favorite morning show in the car on the way to work please
play podcasts	next podcast play
cooking recipe	how many millilitres is two table spoons
news query	headline news for texas
lists createoradd	start me a new list
transport traffic	how long will it take me to get to park avenue considering current traffic
qa maths	add five plus eighteen minus four please
general confirm	please will you check last thing said.
iot hue lightchange	lights color red
qa definition	meaning of enthusiastic
play podcasts	play podcast for the philadelphia eagles content
play game	play football with me
lists remove	remove item four
alarm set	set my alarm for tuesday at six pm
play podcasts	play my favourite podcast
calendar remove	hey olly make sure my calendar is completely clear tomorrow
lists query	what's next on my list
iot wemo on	wemo plug socket turn on
calendar set	hey turn on your reminders for tomorrow's meeting at ten am
email querycontact	add rebecca green to my list of favorite contacts
music query	show me music by that artist
datetime convert	when it's ten pm here what time is it in brisbane
recommendation locations	which restaurant is there in shivaji nagar
email sendemail	send email to mom asking about the weather
qa stock	what are the stock prices of target
qa definition	google definition for me
iot cleaning	please turn on my vacuum cleaner
recommendation locations	where i can find a bakery
iot hue lighton	switch on the lights
general praise	you are star, musch appreciated, olly.
iot hue lightoff	turn the lights off now
transport ticket	bring me ticket of train to city leeds
lists query	show me my lists
iot hue lightup	turn the chandelier all the way up
iot hue lightup	turn the lights higher
alarm set	make an alarm for four pm
transport query	where is the closest mexican restaurant
iot cleaning	start vacuum
iot hue lightoff	switch off the light
email querycontact	jay's phone number
calendar remove	what do i have to do today
general praise	appreciated, that is great job.
play game	would you like to play a game
qa definition	what does the word labyrinth mean
iot coffee	make a coffee please
transport ticket	book a train ticket to mumbai for tomorrow
iot hue lightoff	turn off kitchen light
alarm set	set an alarm for tomorrow at six in the morning
general confirm	please confirm it.
lists createoradd	create a new list
email query	are there any recent unread emails
lists remove	take milk off my grocery list
transport traffic	what amount of traffic in this road
weather query	it is cloudy today
weather query	will it rain in the noon
qa maths	what is the answer to two by two
qa currency	how many yen for each dollar
iot hue lightoff	please turn off the light
email addcontact	please add smithjoe@email dot com to the contact information for joe smith
qa maths	calculate two plus 29
lists remove	erase spaghetti from list
lists remove	remove that item
calendar query	can you tell me what's on the schedule for tomorrow
general dontcare	this does not matter, olly.
qa currency	please let me know the exchange rate between indian rupees and us
general praise	fantastic job, you did well.
iot hue lightoff	turn down the lights to medium
iot hue lightoff	desk lamp one off
iot coffee	i need one cup of coffee
qa maths	what's three plus three hundred and fifty five
qa stock	how much is amazon stock
iot hue lighton	please turn on the lights in my house
general dontcare	i would not mind for any one.
iot hue lightchange	i would like the like in the kitchen to be a different color
play music	hey play crazy by britney spears
qa maths	solve this equation one plus one
transport traffic	are there any construction areas on harvard
general confirm	check last thing i said.
email querycontact	do i have a home number for shelly
iot hue lighton	it's dark in here
qa maths	what is the linear equation
transport query	give me train times from station to location
transport traffic	should i go through the valley or on the ten to get to westwood
audio volume down	lower volume to half
play podcasts	play me the latest podcast about online surveys
email sendemail	you can send the email to abc@gmail dot com this is my new email address
email querycontact	is there a contact named allen in my list
social post	send tweet to united airlines i'm angry you lost my bags
qa stock	show me the stock prices of target today
alarm set	set alarm to begin
play podcasts	i want to listen to a new podcast on healthcare
qa definition	what i can do with laptop
cooking recipe	how long should i cook a hamburger on each side
play game	play snake with me
transport query	find a train going from prague to brno
lists createoradd	start a list of dog names
music settings	repeat same song for ten times
alarm set	set an alarm for five am
play radio	play the health show on the television in the living room
recommendation locations	where are italian restaurants in me area
transport traffic	is there any traffic
iot hue lightdim	lower lights in kitchen
email query	are there any emails i haven't read yet
email sendemail	email my sister about mom's birthday jane we should think about arranging the party at the park
iot coffee	prepare a cup of coffee for me
lists query	read my list to me
lists query	what is on this specific list
transport traffic	is there any construction on route sixty six
weather query	will it snow next week
iot hue lightchange	can you change the light colors into dark in the house
social post	new twitter message
audio volume up	please turn up the volume to twenty one
play radio	start bbc radio
lists createoradd	add appointment in the list
lists query	to do list for today please
general affirm	correct response to the command.
general affirm	you've got the answer perfectly.
play game	lets play battleship
lists query	what is the list type
email sendemail	you should reply to the mail
qa currency	exchange rates between dollar and euro
email addcontact	add this email to my address book
iot hue lightoff	turn bedroom lights off
lists query	read available lists
transport traffic	are there any accidents on my way to work
general affirm	yeah exact response to the command.
play music	play a song that will make me smile
social post	i have a complaint
cooking recipe	best energy food for gym
general praise	you are helpful, appreciated.
email sendemail	send reply thank you so much mom to mom
calendar query	what important dates are there in my calendar this month
play game	open up tetris
email query	can you check to see if i have any recent email alerts
recommendation locations	have any suggestions for local italian food
lists createoradd	add the item to the list
cooking recipe	how many eggs should i put in my cake mixture
lists query	tell me the names on the list
music query	show me the name of the song playing right now
general praise	perfect job, you have done well.
music settings	turn on repeat
calendar set	add to calendar an medical appointment for the first day of the next five months
play radio	play football news from radio one
general commandstop	please will you shut off.
music query	when did pop it like it's hot come out
lists query	display my list
lists query	give me all my lists
lists query	provide what is there on the list
iot hue lightchange	change the light colour to green
iot coffee	i need coffee please preferably hot
transport query	train times location
calendar query	do i have free time next tuesday to schedule a meeting
social query	how many notifications do i have on facebook
qa maths	how to calculate trigonametry
transport query	what time will i arrive in austin tx
email querycontact	does bob live in france
play podcasts	please check episode number thirty nine
calendar query	do i have any appointments coming up
general dontcare	i don't mind for whatever.
iot hue lightup	can you make the room brighter
iot coffee	can you please make a coffee
general commandstop	that's all, just stop.
iot hue lighton	it's awfully dark here
datetime convert	what the time difference from here to ottawa
calendar remove	format data from calendar
play radio	i want to listen to the bob and tom show
datetime convert	what is the time difference between eastern and pacific time zones
social post	please tweet a complaint about slow service at applebee's
transport ticket	please train
weather query	how much snow has fallen in maine since yesterday
alarm set	set a repeating reminder alarm for the facebook event i have to attend on seventh april
email sendemail	open a reply message
email query	list all emails with subject contract
iot cleaning	switch on the roomba
iot cleaning	start the robot vacuum cleaner now
general affirm	yeap you've gotten my instructions perfectly.
general dontcare	that is of no importance for me.
iot coffee	make me a coffee please
email query	what did the clinic say about my exams
qa currency	how much yens per u. s. d. today
play music	play lady by kenny roger
news query	what is happening in the world today
transport traffic	how is the current traffic between
email query	did i receive any email in the past hour
qa definition	description of iphone seven
social post	bring up twitter to target customer service
iot hue lightup	brighten the light of hall
email addcontact	add new email to contacts
transport ticket	i need a train ticket traveling to new york in may
email query	check all the new them emails and mark them star
iot coffee	double cappuccino small please
qa factoid	how far is parana river
calendar query	do the knicks have a game at home tonight
play music	play music that are classical only
general affirm	yes fantastic response.
music query	show me the picture of the singer
calendar remove	remove all my engagements from calendar for tomorrow
transport ticket	i need you to book a train ticket that leaves at two pm
social query	do i have any private messages on any social media
qa stock	stock google find out
email sendemail	send email to mommy that i'll be going the party
email query	check to see if my mom sent me any emails
qa currency	what is the exchange between dollar and british pound
news query	cnn headlines
iot wemo on	turn on the plug
iot cleaning	please run the vacuum cleaner
qa currency	dollar rate at present
transport traffic	what's the traffic this morning
alarm set	set a continuous alarm without the option to snooze for seven am please
alarm set	set alarm at six thirty am
qa maths	tell me what the product of eighteen and thirty one is
qa currency	what is the us dollar equivalent of one euro
email query	update on email
qa factoid	how many legs does a dog have
social post	tweet my current location
iot coffee	get coffee maker started for a fresh cup
general confirm	would you please check instruction.
calendar query	what am i up to this weekend
qa stock	update me on stock price of this company stock
social post	write complaint to wallmart
iot hue lightchange	make the lights in the house red
calendar set	set a notification for june fifth every year
calendar remove	can you please disregard the party that i will be going to this weekend on my calendar
iot coffee	program coffee machine to brew coffee in two minutes
weather query	what is the forecast
iot hue lightup	brighten up the lighting
email sendemail	please send mom an email saying that i can make it next week
play radio	start radio station one oh seven point five fm
qa maths	solution for eighty one divided by nine
audio volume up	i can't hear you
general commandstop	olly will you stop it.
lists query	what is available in your stock of lists
general confirm	please can you check that.
general praise	you helped a lot, i appreciate it, olly.
datetime convert	how much later is new york than la
iot hue lightup	turn up the lights in the living room
iot hue lightchange	show me the available colours of lights
email sendemail	prepare email for susan
iot hue lightoff	please turn off right side of light
general dontcare	that is unimportant to me, olly.
recommendation locations	please list shops within one miles from me
iot wemo on	wemo on
play music	make my collection mostly pop with a good bit of psychedelia
qa stock	what are the stock prices
social query	tell me my friends most recent update
cooking recipe	how to make chicken tikka
general affirm	yes wonderful response.
social query	what's going on on fb
iot hue lightoff	please turn the lights off
email query	my mail
datetime convert	what is the time difference between here and japan
play podcasts	start next episode playing
play radio	play random radio station
play game	load a fun game that i can play with you
transport ticket	book my train ticket from las vegas to los angeles
general confirm	please confirm my last question.
music query	title of song
general confirm	please check and confirm the last thing said.
general dontcare	have no idea regarding to what to do.
transport query	find me a train ticket for the next trip to washington dc
qa factoid	area of north america
general commandstop	will you stop please.
qa currency	given me the exchange rates between u. s. d. and cad
general affirm	yeah that is correct.
calendar query	where is tuesday's morning meeting
weather query	will it get warmer here next week
general commandstop	olly please will you shut up.
play radio	eight hundred and eighty nine fm please
play podcasts	play the next show on podcast
general praise	i appreciate answers.
general confirm	check what just said please.
iot wemo off	hello i want to turn off my wemo plug
lists createoradd	Put milk on my shopping list
play music	please play the early franks sinatra stuff i have
calendar remove	delete all of my appointments with dr smith this week
play game	play for me the game cricket
email query	show me the email of jack
social query	show me my social media notifications
