qa maths	let's do math
lists createoradd	please create a new list
cooking recipe	show me a spaghetti recipe
qa factoid	tell me about donald trump
play podcasts	i want you to play the podcast
iot hue lighton	clap on
qa stock	list the latest apple stock prices
audio volume down	turn down the sound
general commandstop	would you stop please.
weather query	will i be able to get away with shorts today
transport ticket	book a first class ticket in the next train to miami
music query	hotel california is sung by whom
recommendation locations	locate me the amazon restaurants
qa stock	is i. b. m. up today
social post	post the following status to facebook
play game	angry bird
lists remove	get rid of bananas on the list
play radio	play station gx in the radio
email query	update my inbox please
transport ticket	show me train tickets
qa currency	show u. s. d. currency value of euro
general commandstop	please can you stop it.
qa currency	how many dollars is in pounds
email addcontact	add this new email
transport ticket	book a train for me
iot wemo off	turn the wemo off
qa definition	define the moon for me
alarm set	set an alarm for seven thirty am
general praise	you are my hero, thank you very much, olly.
social query	show me my husbands facebook posts today
email query	please tell me how many emails i have
calendar set	open calendar and make an event reminder
general commandstop	will you shut up.
social post	complain to philips
music query	what song is on the radio
iot wemo on	turn my smart plug socket on
general commandstop	olly can you stop it.
lists remove	remove the item from list
lists createoradd	prepare a new list
iot hue lightchange	house lights blue
music settings	turn shuffle on music player on
qa stock	how is shell s stock doing today
general commandstop	would you shut up please.
transport query	what time is the train to san francisco due
email querycontact	please find a mail address of manoj and tell me
qa currency	please check the exchange rates of the us dollar vs the euro
qa factoid	when is shakira's birthday
general confirm	could you check and confirm detail please.
play podcasts	resume series podcast
iot hue lightoff	did i leave the light on in the garage
transport traffic	are there any traffic delays
email addcontact	add john@gmail dot com to contacts
play music	show me the best podcast of folk songs having good rating and play it
calendar remove	remove father's day from calendar
lists remove	take that off there
transport traffic	how is the traffic on the i fifteen in las vegas today
qa stock	what is motorola going for today
play radio	i need you to find a good channels to listen to
transport ticket	buy me a ticket to take the train to atlanta
qa factoid	show me the demographic growth rate of switzerland in the last ten years
iot wemo off	turn off my smart plug socket
lists remove	delete this item
play radio	ally please play pandora radio
social query	what's the most popular story on my facebook newsfeed
calendar set	please set reminder
iot coffee	can you please turn on the coffee pot to make me coffee
calendar set	make a repeating reminder for tomorrow
transport ticket	book a train ticket to boston tomorrow
iot hue lightup	increase the brightness of the lights
social query	did anybody post on facebook today
news query	keep me informed about bitcoin price
music query	what album is this song on
play podcasts	forward to four twenty
lists createoradd	please find all name start with alphabetic of g and create a list
calendar query	need information about events before shift ends
general commandstop	would you just stop it please.
social query	who has written to me or mentioned me in social media
weather query	how is weather on such and such day
recommendation locations	can you tell me the cheapest place to get ground beef
alarm set	set alarm of every tuesday of march month morning eight am
iot hue lightoff	please set the lights off in the living room
general confirm	can you confirm it.
iot cleaning	put on the vacuum on now and clean the living room
transport query	get route for los angles from here
email query	who was the last person to email me
iot hue lightdim	this is too bright
lists query	can i have my list
play game	play game
iot hue lightdim	reduce the light power
social post	tweet consumer service that the goods are of low quality
social post	tweet paula deen's restaurant that the line is always too long
transport query	when is the next train to london
email sendemail	i want the email to be sent to my new email address abc@gmail dot com
iot hue lightup	brighten the light at seventy percent
lists remove	drop it from list
general commandstop	that is all, stop it.
general praise	you are smart, olly.
general praise	that's cool, thank you very much, olly.
qa stock	show me share price of amazon
transport query	tell me the train ticket price of california to chicago
qa stock	were the stocks rising or declining
play music	play the song title
weather query	what is the current temperature outside
weather query	it looks sunny and clear today is that true
qa currency	give me the exchange rate between united states dollar and canadian dollar
play radio	please tune in to fm ninety five
alarm set	one am set
email query	carlos linux upgrade email
music settings	shazam this music
lists query	open my list
iot wemo off	please turn off my smart plug socket
weather query	is today a sunscreen day
general dontcare	i would not know, olly.
transport traffic	what is the status quo for traffic right now
general commandstop	please can you cancel it.
email query	what is the email sent by this contact read
alarm set	set the alarm for nine am on weekends
transport query	can you reserve a ticket to grand rapids by train
general commandstop	olly could you shut up please.
iot wemo on	start the laundry
datetime convert	change my clock to central time zone from my current zone
transport ticket	book a train ticket from here to charleston west virginia at eight am today
lists query	what's my to do list for today
music settings	play only particular singer songs
email querycontact	fetch me the phone number of Alexander
general confirm	check and confirm the last thing said please.
weather query	what should i wear is it cold outside
iot wemo off	turn off kettle socket
general commandstop	olly will you cancel please.
qa factoid	when does the super bowl officially start
weather query	is the sun gonna shine in devon this weekend
lists remove	take bread out from the shopping list
transport query	show me today all train times of next two hours at jodhpur to pali
transport traffic	what is the traffic this morning
iot hue lighton	light up the lights in the kitchen
weather query	will it rain
calendar remove	delete all recurring staff meetings
weather query	what is the weather update for tuesday
email addcontact	add new email to anna
general affirm	yes perfectly.
email sendemail	email my mom
cooking recipe	find a recipe for homemade bread
iot hue lightoff	bed room two lights off
general commandstop	olly just stop.
social query	check my social networks
transport query	show me the path of nearest railway station
iot cleaning	hurriedly activates my robot vacuum cleaner
email query	new messages
social post	send a complaint to my boss
calendar query	what time is the evening meeting i have with john
general confirm	did you get my last command correctly?
email querycontact	what is jimmy johns's corporate number
qa definition	what does a grapefruit look like
qa definition	give me the definition of formidable
general commandstop	will you shut down please.
calendar remove	delete my next meeting
email querycontact	please check and tell me contact details of mongomery llc company
alarm set	make an alarm for me at five am tomorrow
social query	what's new in facebook
alarm set	can you set the alarm for one hundred and thirty
weather query	will there be snow this week
iot hue lightoff	turn the left light off
music query	what music do i usually listen to
transport traffic	are there any traffic restrictions due to the president's visit
iot hue lightchange	i would like the house lights to be pink
play music	play my most played songs
weather query	i want the complete weather details of seventh march
alarm set	make me a wake up alarm for eight forty five am
play podcasts	please start the podcast
qa currency	if i have a dablune how many dollars is that
general commandstop	olly can you shut up please.
iot cleaning	power up the vacuum
play radio	play the radio
iot hue lightoff	can you turn off the living room lights
email query	do i have email from my friend rachel
iot hue lightdim	lower lights now
calendar set	schedule lunch at tomo in arcata california tomorrow at noon
social post	send twitter to mattel that they need to stop making toys in china
lists query	the list contain what
play music	play r and b
calendar query	do i need to pick up the kids from anything today
general praise	it's useful, thank you so much.
cooking recipe	please search for beginners guide to cooking
lists createoradd	add milk to grocery list
general affirm	yeap amazing response to the command.
transport ticket	book a train ticket for tomorrow going to new york
qa definition	describe a fifty inch smart tv
iot coffee	make me coffee in five minutes
email querycontact	open the profile of allen from my contact
iot hue lightchange	give me red lights
iot hue lightdim	down the light power
calendar set	remind me at the start of each month
calendar query	give me the reminders
general confirm	check that.
calendar remove	delete all the events of today
iot hue lightdim	change the lights to dim
general affirm	you have got the answer exactly.
alarm set	set the alarm for tomorrow five am
email sendemail	reply email to charlotte
iot coffee	make a coffee for me
qa definition	what does a beech tree look like
iot coffee	please make me nice coffee
qa maths	how much is remaining after subtracting four from eight
iot hue lightoff	turn off the light in the bathroom
play music	play song aces high
iot hue lightoff	turn off bedroom lights in ten seconds
iot coffee	please get the coffee machine to make me some coffee
play music	play some boy band music
news query	what is the news today
lists createoradd	i need to make a grocery list
play podcasts	next episode in podcast
social query	check my facebook for notifications
alarm set	set alarm at nine am on next sunday
transport traffic	what is the traffic like today
play radio	play power one oh two point three
play game	play golf
general commandstop	that is all.
iot hue lightup	increase light intensity
lists remove	abolish an item from list
alarm set	please set alarm for all days
general affirm	yeap you get your understanding exactly.
email query	check all new emails in my inbox
iot hue lightchange	change my room lights so that i can get a good sleep
lists query	what are all my lists
qa factoid	what year what the eiffel tower built
social post	tweet starbucks and say that the customer service is awful
general dontcare	would not bother, olly.
recommendation locations	find tacos near my home
transport query	what is the route to the closest mcdonalds
email querycontact	call mom
iot coffee	i need some coffee
qa currency	how much is dollars american worth in yen
cooking recipe	how to make fried rice
qa currency	u. s. d. position now
general confirm	confirm the last thing said please.
qa factoid	how many oscars does morgan freeman have
qa currency	how much australian dollars one can buy for one pound sterling
music query	nine hundred and ninety nine fm is currently playing what music
cooking recipe	please cook me a hamburger
music query	what's the name of the piece you are playing
social query	what's new on my facebook account
email query	tell me when i get new emails from principal lowry
qa factoid	what is the capital of new hampshire
weather query	is it going to rain in the next few days in tucson
alarm set	set an alarm for eight am
social post	tweet my complaint to @consumer service
iot cleaning	open vacuum cleaner
iot hue lightchange	can you change the living room lights to a softer color
music query	who is singing the song i am listening to right now
play podcasts	skip this episode
general praise	it was amazing, olly.
play podcasts	play next episode
lists query	check item five on my to do list
audio volume down	lower your volume please
iot wemo off	off mobile charger plug
general confirm	did you get that correctly?
lists createoradd	new item for list
general praise	that was cool,, olly.
general commandstop	please cancel.
calendar query	what do i have scheduled for next week
recommendation locations	what is a good place for cruise
transport ticket	book next ny train ticket
transport query	how to go to multi specialty hospital
play radio	play nine hundred and seventy one
social post	two thumbs down @companyname
play podcasts	show me podcasts
audio volume up	volume louder please
general dontcare	i don't mind to select any one.
email addcontact	i would like you to add an email to my contacts
iot cleaning	there is a pile of torn paper on the rug to suck up
general commandstop	cancel.
transport ticket	find out the the train arrival time and book me
iot cleaning	begin vacuuming
lists query	can you please tell me what i have on my list
news query	hackernews
qa stock	what is the stock price of nike today
email querycontact	what is the home phone number for sarah
iot hue lightoff	turn lights off in kitchen
iot hue lightchange	turn lights blue
social post	tweet the president and tell him he's doing a horrible job
cooking recipe	find the recipe for sambar in cookingforu application
qa currency	could you please tell me what is the rate for pound to u. s. d.
lists query	tell me what is in your list
play podcasts	podcast next episode
transport traffic	what are the traffic conditions currently
general commandstop	olly please would you shut off.
calendar query	do i have a meeting today
audio volume down	can you speak quieter please
alarm set	could you please set an alarm at six am
general dontcare	whatever would be good to me, olly.
general dontcare	whatever would be good.
play music	i want to hear tum hi ho next
general dontcare	wouldn't mind for any one.
lists remove	remove chores from my to do list
email query	has mike sent me an email
general praise	it's fantastic, thanks.
calendar query	who is scheduled for tomorrow's meeting
transport ticket	i want a train ticket from los angeles to phoenix
play game	i feel like playing chess can you play that
general confirm	could you please check and confirm the detail.
play podcasts	play that podcast please
iot wemo on	start new smart socket
qa currency	how much is ten euros in dollars
lists query	what kind of lists do i have saved
iot hue lightup	please turn the lights up
qa currency	is a peso worth more than a dollar
email query	what are the subject line and sender from today's email inbox
news query	what is happening in the world news
iot hue lightdim	please turn down the lights
transport query	fix the driving route from here to grant market
iot hue lightup	raise lights to full power
qa factoid	how old is emma watson newest boyfriend
email query	is there anything new in my email folder
cooking recipe	how do i prepare all my food for cooking
play game	I'd like to play UNO with you
transport ticket	please purchase me a train ticket to atlanta
iot hue lightup	spread some lights
iot wemo off	turn off the fan in the master bedroom
iot wemo off	i want the wemo socket off
lists query	what do i need to complete first from the list
play podcasts	go to the next episode in this podcast
calendar set	can you tell me on tuesday to give jane a call
play game	would you like to play a game with me
iot hue lightoff	turn the room light off
news query	entertainment news
email sendemail	respond to my bosses email with the word that i will be in at four in the evening
general affirm	yeah great response.
email addcontact	add a new email in my contacts from john
qa currency	how much is one dollar in pounds
play music	please play only sad song in music player
play podcasts	get the next episode
general commandstop	olly please shut off.
qa factoid	what is sean connery's birthday
iot coffee	can you see to it that the coffee maker is ready with my filter coffee in approximately ten minutes from now
iot cleaning	run the vacuum cleaner
iot wemo on	make the socket available for me
cooking recipe	give me best cooking ideas
qa stock	stock market
audio volume down	could you please lower the tone
iot coffee	i'd like a cappuccino please
qa factoid	what did kim kardashian wear to london fashion week
qa currency	from dollar to euro
qa factoid	how old is cher
general commandstop	can you shut up.
iot coffee	i want coffee everyday
general commandstop	olly please could you shut up.
iot hue lightdim	lower the lighting
alarm set	i want an alarm for three today
iot hue lightchange	make the living room blue
email query	please check email from my boss
iot hue lightup	a little brighter thanks
email query	check emails for last hour
general affirm	yeah exact response.
music query	listen to this song
email addcontact	store my contacts
email querycontact	show dan's contact detail
lists createoradd	create new list
qa maths	tell me the answer for two plus two
iot hue lightdim	switch light to lowest level in dining area
calendar set	dentist appointment today at nine am
email query	check emails
social query	has anyone follow me today on twitter today
iot coffee	make a pot of strong coffee
play game	i would like to play tetris
iot hue lightchange	make curser adjustable position
play podcasts	please play forward episode in quantico
calendar set	schedule a lunch meeting with brent on Wednesday at noon
qa factoid	when is president's day
iot hue lightup	brighten light
email query	what is the last email i received
social query	has wendy posted on facebook
email addcontact	add work email address
calendar query	please show today meting with clients
alarm set	put an alarm and wake me up at six am tomorrow morning
recommendation locations	nearest walmart location
iot coffee	start coffee machine
social post	send a tweet to company
play game	let's play space invaders together
play radio	please play the local latin music channel on the radio
calendar set	on february fourteenth make dinner reservations at the restaurant
iot hue lightoff	switch off the master's bedroom
iot hue lightoff	switch off light
general praise	it's helpful, musch appreciated, olly.
iot hue lightchange	i would like orange lights now
play radio	play a news radio station
qa definition	what does a sea lion look like
calendar remove	remove john's birthday from the calendar
general commandstop	olly can you shut off.
qa stock	what is the current price of jindel stock
email querycontact	what is email id of john
play podcasts	play the seventh episode of the morning after
general confirm	i like you to confirm question please.
qa maths	calculate two multiplied by two
qa factoid	what awards did erica grebe win last night
email query	do i have a new email from eric
email sendemail	now i need to write an email to my colleague
weather query	ask for the weather today morning
general praise	i appreciate it, it is great one, olly.
general confirm	confirm last thing said please.
email sendemail	send an email to my brother and say wedding anniversary
lists remove	remove this list from the others
cooking recipe	find a recipe for chicken alfredo
play podcasts	play latest reason podcast
lists createoradd	update my list with shoes
calendar query	let's go through all pending reminders
transport query	can you look up train ticket prices for me
weather query	do i need to wear sunscreen today
alarm set	turn on alarm thirty minutes before liverpool started to play
iot hue lightup	i want more light
calendar set	remind me about calendar
qa currency	rate u. s. d. to g. b. p.
iot cleaning	turn on the vacuum cleaner
general praise	appreciated, that's nice.
weather query	is it sunny in gonbad now
email addcontact	please add to my contact lists and send them a reminder email
calendar remove	get rid of the first three events in my calendar
calendar set	remind me of my twelve oclock meeting by eleven thirty
iot hue lightup	i can't see let's make it brighter
music settings	turn on spotify shuffle
general praise	ah that is great one.
iot hue lightchange	set the lights on blue
lists query	what is on my rap playlist
cooking recipe	what conducts heat better copper bottomed pots or cast iron
qa definition	how does a cheetah look
iot wemo on	if switch is on then turn on else turn off
qa factoid	how old is christie brinkley
calendar remove	remove the event from monday
play music	Play something random from google play
lists createoradd	put pencil on a new grocery list
transport query	what are the train times from san francisco to new york
transport traffic	system pull any traffic news for my commute
iot hue lightup	make the light more visible
social post	can you contact samsung and say my washer is on fire
general praise	thank you so much for the help, olly.
qa factoid	who was the first president of united states
transport ticket	i want the cheapest train ticket to new york
general confirm	can you check last thing said please.
transport query	show me today all train times of next two hours at jodhpur to jaisalmer
iot hue lightchange	turn the living room lights to one percent
qa definition	describe a romantic love
play radio	look for a radio station called rhythm on the frequency one
lists createoradd	set list
qa factoid	how old are kim kardashian's children
calendar set	the meeting with justin and katrina has been changed put it on thursday
social post	let wendy's know i hate them
email querycontact	can you tell me the phone number of me
qa maths	whats ten percent off forty dollars
iot cleaning	initialize the robot vacuum
play music	play led zeppelin houses of the holy
datetime convert	what time is twelve pm eastern time in pacific time
weather query	am i going to swim or work today
iot wemo on	i'd like you to turn turn on the tv
calendar set	add my spin class to the calendar for Saturday at seven am
calendar remove	get rid of everything on my calendar
email query	check for new emails
music query	is it possible for you to provide the likes of my music
transport ticket	i need a ticket on the train to new york city tomorrow
iot hue lightchange	can you please change the mood of the light
general affirm	yeap fantastic.
play game	open up angry birds
general affirm	your understanding was exact.
qa maths	can you help me find the answer to this question
general dontcare	have no idea for which to choose.
transport ticket	please book train ticket to new york
transport traffic	how is my commute
transport query	can you find me a train ticket to montauk
qa stock	what is apple's stock
general commandstop	i like you stop it.
qa factoid	how smooth is marble floor
iot wemo off	i do not want to use the socket anymore
iot hue lightoff	put the lights off now
weather query	will I need a raincoat when I go to glasgow on sunday
email querycontact	please delete the contacts that i havent spoken to in three of months
play music	next i want to hear shinedown
calendar set	repeat birthday
qa currency	currency conversion of u. s. d. and eur
general confirm	could you please check and confirm last thing i said.
qa factoid	what is glass made of
qa currency	how many euros for one u. s. d.
general dontcare	don't mind.
qa currency	what is the price of euro to u. s. d.
iot hue lighton	turn on all upstairs lights
iot hue lightchange	change the light color the red
email query	did dan send me any emails
email sendemail	prepare to send an outgoing reply message
play music	turn on the tunes
transport ticket	open train ticket app
general confirm	check question.
general dontcare	i wouldn't really mind.
play game	let's play a game of trivia
lists createoradd	i need to make a list
lists createoradd	make a new list for school supplies
iot cleaning	please help me turn on the robot vacuum cleaner
general commandstop	please would you just cancel it.
play radio	play the bob and tom show
iot hue lighton	turn all lights on
iot hue lightdim	please turn the lights down
lists createoradd	can you please create a list for me
calendar set	next week my uncle birthday
email sendemail	email my friend about our plans tonight
lists remove	remove list of due payment of rajesh
general dontcare	any one will be okay with me, olly.
general dontcare	would not mind to select any one, olly.
transport ticket	help me book a train ticket
transport query	show trains and time to ny
general confirm	did you get it correctly?
play music	can you play rfi
calendar query	please tell me what day this event reminder is set for
qa definition	what is the definition of problematic
social query	has anyone tagged me in a photo on facebook
email querycontact	how many phone numbers do i have for brenden
transport query	find me the distance and direction by train to rccg in ikoyi lagos
iot hue lightchange	change my room lights to blue
qa factoid	can turkeys fly
transport ticket	buy me a train ticket
calendar set	reminder about meeting from eight am to twelve pm
qa factoid	what's the capital of tanzania
iot coffee	my coffee is cold please make more coffee
iot hue lightup	can you raise the lights for me please
music query	tell me the singer of this track
qa currency	how many pesos to an american dollar
calendar remove	remove sample meeting from calendar app
transport ticket	i want to book a train ticket
transport traffic	how is the traffic in mg road
qa maths	tell what is the value of sin thirty
general confirm	i like you confirm last thing said please.
general dontcare	does not matter for me, olly.
transport query	from where can i get a train ticket for athens
general praise	you did awesome work,.
qa stock	i want to figure out the stock on microsoft
weather query	give me the weekly weather near me
iot hue lightchange	show us red
play podcasts	move to the next episode of hipsterhood
transport ticket	book a train ticket from washington dc to savannah georgia
