play podcasts	play the next recording
qa factoid	how many pages long is harry potter
social query	social media
general commandstop	please could you shut off.
alarm set	set an alarm for eight pm
play radio	switch on the radio
general dontcare	it is unimportant to me.
general commandstop	i like you just cancel.
play radio	play an fm
cooking recipe	find apple pie recipe
general affirm	exact.
qa factoid	michael jackson family background
alarm set	alert me at three pm to goto the concert
recommendation locations	tell me where the local shopping district is
iot hue lightchange	let's have a warm glow in the front room
qa maths	what is the sum of fifteen ninety nine dollars and six sixty five dollars
iot hue lightoff	can you turn my bedroom lights off
lists createoradd	make a list of numbers for me
general praise	thanks for your answers.
weather query	is it sunny in gonbad now
news query	what is the latest news on sprint
transport traffic	is there traffic right now in maiden lane
general confirm	would you please confirm that.
iot hue lightdim	this is too bright
social query	what are today's highlights from facebook
general praise	you helped a lot, i appreciate it, olly.
qa maths	how many three are available in twenty seven
lists createoradd	add a new list
play podcasts	play the seventh episode of the morning after
general praise	you did nice job, appreciated, olly.
datetime convert	what is the time difference between eastern time and pacific time
play music	play the billboard top ten
general commandstop	olly please would you shut off.
calendar query	give me today's calendar events after six pm
general commandstop	olly can you please shut off.
qa currency	new exchange rate
iot hue lightchange	make the lights shine blue
qa maths	how much is one hundred and thirty six plus three hundred and eighty seven
play music	song next
qa stock	how much would it cost to buy stock in apple
social post	send a complaint to my boss
iot hue lightup	can you brighten the lights for me
qa currency	how much is a g. b. p. in u. s. d.
lists remove	trash file one
lists createoradd	start a list of dog names
recommendation locations	what pubs are close
qa stock	please tell me when i can become rich if i invested in dow stocks today and what will be the return after five years
recommendation locations	locate nearby dining places
iot coffee	i would like to have a cup of coffee
play podcasts	play the next episode of drunks and dragons please
music query	who sings this
iot coffee	go and make me a coffee
lists remove	scratch that one from the list
calendar remove	can you remove that on my calendar
play game	anyone for tennis
general affirm	yes you get your understanding perfectly.
general praise	you are so helpful, thank you so much, olly.
alarm set	set a timer at five am seven days a week
iot hue lightoff	turn lights off
iot hue lightup	increase the brightness in this room
general confirm	please can you confirm the question.
general dontcare	that does not matter.
calendar remove	please empty my calendar
iot hue lighton	turn on the lights that are outdoors
iot wemo off	hello i want to turn off my wemo plug
general praise	thanks for asssistance.
cooking recipe	what is a cookie recipe
iot cleaning	start robot vacuum cleaner
news query	what were the cities affected by the earthquake
social post	put this on my facebook
calendar remove	please delete my lunch date from the march twenty third schedule
general confirm	please can you check the last thing i said.
qa definition	what is this thing
transport query	how do i get from where i'm at to universal in orlando florida
calendar remove	can you delete all events from my calendar
qa currency	what is the current exchange rate of euro to dollar
audio volume down	turn down volume twenty percent
lists query	what on my play list
play game	play subway surfers with me
social query	give me some funny facebook posts
audio volume down	lower the volume of the speakers
social post	tweet insight cable's customer service and tell them i have been waiting on hold for thirty minutes
weather query	what will the weather be like on saturday
transport ticket	book a train ticket to city leeds
play music	play from smashing pumpkins
audio volume up	Hey turn the volume high
music query	listen to this song
general praise	it's good one, appreciated.
general commandstop	olly shut down please.
music query	recommend songs based on my playlist
iot coffee	i will need my filter coffee in ten minutes please ask the coffee maker accordingly
email addcontact	add this email to my address book
general affirm	yes fantastic.
weather query	ask for the weather today morning
transport ticket	google train tickets to washington dc
weather query	will it rain
general affirm	yeah you have got your understanding perfectly.
iot hue lightchange	color change of lights
lists query	what is available in your stock of lists
general affirm	yeap that's right.
play radio	play me a radio channel for trance music
calendar set	don't let me forget i have a parent teacher conference this monday at four hundred pm
audio volume up	could you speak up
iot hue lightchange	change the light color to blue
lists remove	get rid of mike stein from contacts list
iot cleaning	please activate my vacuum cleaner
iot cleaning	vacuum living room
iot hue lightoff	could you please turn off the overhead light in the kitchen
iot hue lightdim	is it ok to lower the lights
email addcontact	save email id
transport query	give me train times from station to location
social query	trending social media
email query	give a last minute update on incoming emails please
qa currency	what is the rate for g. b. p. to u. s. d.
transport traffic	what's traffic likexchange on four hundred and forty one
iot hue lightoff	make the lights off
audio volume up	speak as loud as you can
recommendation locations	tell me a nice chinese restaurant
weather query	what's the weather supposed to be like on wednesday
email sendemail	please send an email to john saying i'm on leave
transport traffic	give me the update on traffic at new york
email addcontact	will you please put something something@gmail dot com in my contacts
music settings	repeat this song three times
calendar remove	remove upcoming task
iot cleaning	at one pm today start the robot vacuum cleaner
music query	what's the name of this song
music query	who is the music director of this song
calendar set	write down meeting at seven pm
play game	can you play a game with me
qa definition	please describe a car
transport traffic	traffic please
general dontcare	really don't mind, olly.
qa currency	what is the dollar exchange rate
lists remove	move buying eggs item to trash from to do list
calendar query	is the thanks giving event on fourteenth of this month true
audio volume up	please increase the volume of the music hips don't lie
iot hue lightdim	lower the lights in the house please
transport ticket	book me a train for the next available train
play game	let's play you'll be the keeper and never change position
play radio	please start the radio
iot wemo on	turn on wemo plug in game room
transport query	what time does the train leave for chicago
transport traffic	what is level of traffic at washington
lists remove	remove apple from list
iot cleaning	start cleaner
general confirm	please would you check and confirm it.
general commandstop	olly i like you just cancel.
lists query	what is that on the list
email querycontact	do i have the address for the apple store in my contacts
qa stock	current price of google please
qa maths	what is eighty seven minus fourteen
social query	hey olly inform me about latest picture updated by priya chopra on instagram
lists remove	remove item from list
weather query	will i need an umbrella tomorrow
news query	usa today headlines
iot coffee	prepare some cups of coffee for us
email addcontact	please add tom to my contact list
social query	tell me what's going on with facebook
iot coffee	can i please have a cafe americano
music query	music traking
qa definition	what is the definition of this
iot hue lightdim	please lights less brighter
iot hue lightchange	change the light colour to green
lists createoradd	this item should be added to the list
calendar query	first week of march meetings
iot wemo off	please turn off the wemo plug socket
iot wemo off	deactivate smart plug socket
recommendation locations	which shops can i find in milan
lists query	list entry
music query	what song in the theme song for frasier
news query	please keep tabs on how the presidential debates are going
news query	what is the seattle city council doing about homelessness
qa stock	show me share price of facebook
play radio	open pandora play rock station
lists query	please tell me what lists i have
datetime convert	please convert the time of here at nine pm to brasil time zone
iot wemo off	please turn off my smart plug socket
play podcasts	search for podcasts that cover men's issues
audio volume up	up the volume the sound is too low
weather query	when is the next time it will rain
iot hue lightup	brighten my bedroom light
email query	has mike sent me an email
social post	start complaint to walmart
general praise	it was nice one, thanks.
qa factoid	how big is the grand canyon
qa definition	define television
weather query	whats the weather now
iot cleaning	clean the floor
social query	what's happening on social media right now
email query	did i email tom on the subject of gun control
transport traffic	is the road clear in florida
weather query	what is the current temperature outside
play radio	activate radio and tune into nine hundred and eighty nine
music settings	enable shuffle
general confirm	can you check my last question.
play game	do a tournament with me in candy crush
datetime convert	i need the time zone from london england instead of central time zone
general affirm	yeah you got your understanding perfectly.
qa definition	look up a lamp
general confirm	check last thing i said please.
lists createoradd	start a new shopping list
qa definition	what does potato mean
general confirm	will you confirm that please.
cooking recipe	instructions to make a meal
qa stock	how much does bde cost
weather query	has the weather changed for wednesday at all
audio volume down	please speak quieter to me
qa maths	what is the answer to that question
iot hue lightup	brighten light
play podcasts	find me the latest podcast about president trump and his immigration ban
cooking recipe	give me recipes
cooking recipe	how to cook crabs
qa stock	tell me which stocks were the biggest gainers in stock market nasdaq today
qa definition	what is laptop
transport query	how far is the distance to rccg ikoyi lagos from here by train
email addcontact	add this email to my contacts
iot hue lightoff	turn off the light in the bathroom
email sendemail	send answer to george
play radio	play bbc radio four
transport ticket	i need to book a train ticket from mumbai to goa
lists query	what lists are available
qa maths	answer for three times four
play radio	play nine hundred and seventy one
alarm set	set a new alarm for that time
iot hue lightchange	switch the lights to blue
lists query	tell me the names on the list
calendar set	repeating event meeting on mondays
transport query	please tell em the list of trains to chicago via california
transport traffic	is the traffic free in some particular road
weather query	do i need to wear a coat today
iot wemo on	please turn on my smart plug socket
social query	what's the most popular story on my facebook newsfeed
general dontcare	i do not really mind for whatever.
iot hue lightchange	please set the lights to green
qa factoid	is the largest ocean in the world the pacific
social post	tell comcast their customer service is slow
transport ticket	book a train ticket from washington dc to savannah georgia
email sendemail	send a reply to robert for his email received today morning
general confirm	can you check and confirm my last command please.
weather query	what is the temperature
iot hue lightup	i need the lights in here to be turned up to seven
iot hue lightoff	lights off
iot coffee	make coffee at three
general affirm	yes right.
qa factoid	what is sean connery's birthday
qa factoid	what is the size of the united states
general confirm	please can you confirm last thing said.
iot hue lightdim	lower lights now
qa currency	and the pound is doing how badly against the euro
social post	snapchat
social query	who has responded to my business within the last twenty four hours
play podcasts	i want to listen to podcast
email query	please tell me how many emails i have
play music	hey play crazy by britney spears
iot hue lightoff	please shut the lights
weather query	what will the weather be like in austin on march sixteenth
play radio	play my usher radio station
calendar set	add a reminder to my calendar every year on this date
email sendemail	send an email to john that i am on my way to home
qa maths	find the sum of thirteen and fourteen
news query	what's the latest news on donald trump
social query	open social media account
transport ticket	get me a ride on the commuter train from nj to ny
play music	play the electronic playlist
general affirm	yeah you get command exactly.
general commandstop	could you stop please.
datetime convert	convert current time from ist to est
recommendation locations	show me some food court nearest to my location
transport traffic	are there any traffic restrictions due to the president's visit
email sendemail	mail macs@xorg
transport query	please let me know the time of train northern rail
lists query	what are the items on my list
audio volume up	turn up the volume on the music
email query	do i have email from my friend rachel
cooking recipe	how long do i roast chicken breasts
qa maths	whats was the value of x if x plus two equals five
lists query	can you tell me what list i have
lists query	pull up the shopping list
social post	tweet a disgusted face about mcdonalds
datetime convert	convert time zone to ist
calendar set	repeat reminder for my schedule for christmas
iot wemo off	turn off the rice cooker socket
general commandstop	olly would you shut off please.
iot cleaning	can you turn on the vacuum
social query	are there any interesting stuff happened today in my twitter
general commandstop	olly that is enough, just cancel.
calendar query	tell me what is on the schedule for july seventh
cooking recipe	give me best cooking ideas
email query	have i gotten any mail recently
audio volume down	turn down media volume
email sendemail	send a request to martin
play music	find and queue all songs of kate perry and play all without shuffling
iot cleaning	cleaning is good dust is so bad do now your magic clean my carpet
calendar set	please remind me that i have a meeting tomorrow ten in the morning
music settings	repeat the music
iot coffee	it's coffee time
iot hue lightchange	please make the lights blue
email querycontact	does my co worker have a home phone number
lists query	whats on my shopping list
qa maths	what is twenty percent of one hundred and fifty
weather query	please tell me the chances of rain this week for zip code twenty nine thousand nine hundred and seventy eight
general praise	it's great one, i appreciate it.
qa stock	give me the stock price of intel
recommendation locations	is there any salon in babaji nagar
social post	tweet complaint to sony consumer service
general praise	thank you so much for the information.
lists query	do i have banana in my shopping list
play radio	play hot ninety seven
audio volume up	louder
weather query	will it get warmer here next week
play podcasts	next podcast play
play game	i want to play a trivia game
cooking recipe	what are the steps for biriyani meal
lists query	could you open my list app and check for groceries please
recommendation locations	where should i go eat tonight
iot coffee	make me some coffee from the coffee machine
lists remove	please remove the list
play game	play for me the game star wars
general confirm	would you check and confirm detail please.
iot hue lightoff	good night lights off
general praise	that's good one, olly.
iot hue lightdim	turn down the lights
music query	who's playing this
email sendemail	reply to john's email today saying i will be late
iot cleaning	i need you to turn on the vacuum cleaner
play game	i would like to play tetris
play game	lets play
lists createoradd	i want to know could an extra item be added to my grocery list
email querycontact	what is mary s.'s birthday
alarm set	new alarm for six am
general dontcare	any one is good, olly.
email querycontact	which contact haven't i called in twelve months
qa stock	look up stock prices for my mutual funds and account
alarm set	wake me up at five thirty
recommendation locations	which restaurant is there in shivaji nagar
recommendation locations	recommend pub in eighth and monte diablo
general affirm	yes you've done your understanding correcly.
audio volume up	audio up
email sendemail	send an email for me
weather query	will it rain in the noon
general confirm	would you confirm the last thing i said please.
iot hue lightchange	change the lighting to blue
play podcasts	play the podcast named ringcast
calendar set	schedule a meeting with reeta today evening at five pm
social post	tweet to consumer service that they should strive to be more accommodating
qa definition	whats the definition of indignation
calendar remove	delete all my events for tomorrow
music settings	replay the musics
lists remove	please delete bananas from my shopping list
qa definition	what is the meaning of the word sanctimonious
iot coffee	can you set the coffee machine to make coffee at three pm time every week day
email addcontact	please add to my contact lists and send them a reminder email
play podcasts	play current episode
email querycontact	where does fred work
qa factoid	how far is france from miami
iot hue lightchange	make the bedroom lights red and the hall lights normal color please
lists query	please show me lists
transport query	what time does the train from new york come in
calendar remove	i am busy tomorrow so delete all calendar events
transport traffic	is there heavy traffic on the I fifteen in las vegas right now
play radio	play national public radio
calendar set	please remind me of all the nba scores in a week
qa stock	mention the stock price of hdfc
lists createoradd	add rice on the list
general affirm	you did command perfectly.
news query	newest world news
play radio	play radio mirchi for me
qa currency	what is a canadian dollar worth in the us
alarm set	call me at six am
transport traffic	what is the condition of traffic from work to home
lists query	let me know the list
qa stock	how much has hp stock gone up
audio volume up	turn up
iot coffee	start brewing please
general confirm	could you confirm what i just said please.
general praise	that was cool, i appreciate it.
transport ticket	book next ny train ticket
email querycontact	julie's information
iot cleaning	clean the sofa with the vacuum cleaner
play music	play lady by kenny roger
datetime convert	convert time zone
lists remove	remove the milk from the shopping list
play music	play my country playlist
iot hue lightoff	turn off bedroom lights in ten seconds
general affirm	yes you've understood my instructions exactly.
alarm set	i need you to set an alarm
lists createoradd	create new list for baby names
alarm set	remind me at five pm
transport query	give me the driving directions from faripir to gurpur
email sendemail	send email to mom starting with the subject vacation
transport traffic	traffic status please
datetime convert	what is the time difference between pacific and central
calendar query	is jimmie's party on friday cancelled
iot cleaning	vacuum on
transport query	i need the arrival time for new york train
transport traffic	what is traffic to work now
lists remove	i don't need the shopping list delete it
play game	please choose a game that you can play with me
iot hue lightdim	please turn the lights down
qa factoid	how tall is frank goggins
qa definition	what is rock sand
email querycontact	is bills pager number in my contacts
weather query	how is the weather of this place
play radio	can you play acoustic music with no commercials
transport query	how far is it from tokyo to dallas
calendar remove	remove all the reminders from the calendar
lists remove	remove events from my list
music query	what is the title of the song
transport traffic	give information about the traffic near my location please
iot hue lightchange	change the color of the lights
qa maths	what is three times seven
cooking recipe	whats needed to make pizza
iot coffee	make us a brew
qa factoid	how high is pikes peak
iot hue lightchange	house change all lights to blue
transport ticket	i want a train ticket from boston to new york
play music	play the song for me
recommendation locations	where is the nearest restaurant here
play podcasts	play the podcast of barack obama saved in device
general commandstop	please just cancel.
weather query	what is the climate here today
lists query	what lists available
email querycontact	is this my sisters cellphone number
general commandstop	olly that is enough, cancel it.
qa factoid	where do cows come from
qa definition	siri what is the definition of ziggurat
play podcasts	can you play back to december
qa currency	canadian us exchange rate
email sendemail	email mahmoud
calendar set	reminders
email querycontact	when is john's birthday
play music	start playing my song list
qa factoid	what creates buttermilk
calendar query	tell me about my upcoming week
qa maths	do you know how to answer this math question
music settings	move to the next song in the list
lists createoradd	add eggs to my grocery list
play game	let's play space invaders
lists createoradd	create packing checklist
iot hue lighton	clap on
iot hue lightchange	change the overhead light to orange
general praise	that's helpful, thank you very much.
general praise	ah that's nice one.
general praise	it's helpful, musch appreciated, olly.
iot hue lightchange	turn lights to green
qa currency	how much is one american dollars worth in england
iot wemo off	turn off the wemo plug
email query	what is the last email i received
qa maths	divide seventy six in two parts
iot hue lightoff	turn off the room lights
transport ticket	find me the earliest train ticket departing friday morning to miami
transport query	can you find me a train ticket to montauk
email sendemail	i need to add a new email to my contacts
general dontcare	any one is good to me.
play music	please play the song games by disturbed
lists createoradd	include this item
general confirm	can you please confirm what said.
play game	play game with me
qa currency	how much is indian rupee going against us dollar
iot coffee	program coffee machine to brew coffee in two minutes
transport ticket	order a train ticket to boston
iot wemo off	please mark the wemo socket to off
social post	i would like to make a post on times twitter
datetime convert	what is time now in japan compared to usa
email query	beep when i get an email from john
general dontcare	i wouldn't know.
iot hue lightchange	make the lights blue in here
social post	i would like to place a call to amazon customer service
cooking recipe	how do i cook rice
calendar query	tell me what's happening this week
calendar remove	clear my day on the twenty ninth
qa factoid	is it true the gym is seven miles away
lists createoradd	add eggs to my grocery's shopping list
transport ticket	hey i want to get trains to manchester on Wednesday
email querycontact	open derek's contact information
general commandstop	olly will you please shut off.
transport traffic	what is the traffic condition of florida
general praise	good work, you have done well, olly.
calendar set	call sarah
iot wemo on	toggle wemo plug socket on
email addcontact	open up contacts and add email something@gmail dot com
iot coffee	do a coffee for me please
qa maths	how much is one plus one
play podcasts	play latest reason podcast
qa definition	what an umbrella means
calendar remove	remove all the events in my calendar
iot coffee	i would like coffee now
alarm set	set an alarm at six in the morning
social query	what's the latest in my social media
iot hue lightoff	please turn off all the lights in the house
calendar remove	clear my schedule for today
general commandstop	i want you just cancel it.
cooking recipe	show the method to prepare icecream
social post	complain to amazon customer service for me
recommendation locations	find me the cheapest place to buy a new backpack
music query	do i have any music by lady antebellum
social post	send a tweet about sonys volume issues
qa factoid	when is stassi schroedder's birthday
iot hue lightdim	lower the lights in bedroom two
lists query	make sure bread is on my grocery list
qa currency	find me the exchange rate between dollars and bitcoin
lists createoradd	enter this to a list
play radio	switch on radio mango
qa factoid	tell me who the thirty second president is
iot hue lightup	brighten lights in living room
general commandstop	olly would you shut off.
email query	when did dave matthews email me about the contract
iot wemo off	turn off the lamp socket
transport query	how long does it take to get from here to chicago by train
email query	do i have any new emails from my dad
weather query	will it be rainy tomorrow
general affirm	yes great response to the command.
cooking recipe	help me make brownies
social post	lets send a tweet
calendar set	i need to set up a meeting with the ceo tomorrow
transport traffic	how heavy is traffic on interstate twenty
audio volume down	please talk softer
recommendation locations	any good bike shops in oxford
iot cleaning	activate the vacuum cleaner and use it
qa definition	could you please tell me the meaning for the item laptop
iot hue lighton	turn the lights on brighter
qa stock	what is the stock price of amazon
iot hue lightup	make it brighter in here please
general commandstop	olly that is enough, just stop it.
transport query	when is the train coming
lists remove	delete the list
calendar remove	erase my next event
