datetime convert	can you change my time zone to central
recommendation locations	i need a good shop
qa stock	what is the value of apple
qa maths	how do i get the answer to two plus two
recommendation locations	can you find me a furniture store near me
play game	play for me the game harry potter and the chamber of secrets
iot cleaning	by ten to eleven am daily start my vacuum cleaner
recommendation locations	i want to know what supermarket near me has the best price on gluten free bread
alarm set	wake me up on Friday at five in the morning i need to catch the train
general confirm	please check my last question.
iot cleaning	can you wake the roomba for the kitchen
play music	can you play my music file
general confirm	can you please check command.
iot hue lightchange	change background
weather query	will i be able to get away with shorts today
datetime convert	what is the time difference between here and there
recommendation locations	where to buy cannon cameras
general dontcare	i would not know, olly.
cooking recipe	i need help making pancakes
lists createoradd	add wash jeans to laundry list
general praise	it's amazing job, thank you very much, olly.
general commandstop	i like you stop it.
calendar query	do i have a dentist appointment on monday morning
calendar remove	delete my appointment tomorrow
transport ticket	i need to get to bristol Friday night can you book me a ticket please
general commandstop	olly please just cancel.
qa factoid	Where is miami
iot hue lightdim	lower lights in my room
lists query	what else do i have on the list
transport traffic	give me the idea of current traffic condition
play game	load up ghost recon wildlands
audio volume up	turn up the speakers
transport query	directions please
lists createoradd	show a new list
general dontcare	this does not matter to me, olly.
qa factoid	who assassinated lincoln
qa definition	hey what's a book
audio volume up	please decrease the volume of this song
qa definition	what does a soccer ball look like
iot coffee	let me get a cup of coffee please
iot wemo off	off the plug
social query	check my social networks
iot hue lightdim	lower lights in kitchen
email query	read me new messages from name
lists createoradd	can you add gloria to my list of clients
calendar set	add event book club debbie's house wednesday night
iot cleaning	can you please put the vacuum on
social post	i have a complaint
datetime convert	if it's five am in berlin what time is it here
play music	play my first favorite song on loop
weather query	will i need my snow boots this afternoon
alarm set	please arrange to wake me up at three am alarm
play game	please play my cricket game
play podcasts	i want to listen to a new podcast on healthcare
qa definition	describe joe for me please
recommendation locations	search for nearby chinese restaurants
social post	fraud in weighing products
iot hue lightchange	change light colors from blue to white
qa definition	what is photosynthesis
music query	tell me the name of this song
qa maths	what is twelve divided by four
general confirm	i would like you to check what last said please.
iot cleaning	turn my iroomba on
qa stock	what is starbuck's stock worth
transport traffic	what is my eta to the office if i leave in thirty minutes
general confirm	please will you check and confirm what i just said.
play radio	play the local r. n. b. radio station
alarm set	send me a wake up alert at seven am tomorrow morning
play podcasts	play me a podcast
qa definition	hey what is the definition of recipe
alarm set	olly set my alarm to go off in an hour
iot wemo off	turn off my smart plug socket
lists createoradd	add broccoli to my grocery list
lists query	check my to do list
calendar remove	cancel dentist appointment for this week
iot hue lightchange	switch to night light setting
audio volume up	play it louder
calendar set	let me know when my meetings are on monday
lists query	list things on my list
transport traffic	what is the status quo for traffic right now
recommendation locations	give me some cafes near downtown fort lauderdale
iot cleaning	turn on the robot vacuum
recommendation locations	i need to know where to get chicken wings in benton ar
email addcontact	please add an email for john doe to my contacts johndoe@yahoo dot com
iot hue lightdim	its too bright in here
email querycontact	please find a mail address of manoj and tell me
play music	play songs by adele
transport traffic	what is traffic like
lists remove	please remove a list
news query	can you search trump
iot hue lighton	and the light began
calendar set	add event to calendar
iot hue lighton	turn corner light on
transport ticket	i need the times for the south bound train on allison rd
general affirm	that is correct.
iot coffee	make a coffee
general confirm	check and confirm the details please.
iot hue lightup	turn the chandelier all the way up
music query	nine hundred and ninety nine fm is currently playing what music
weather query	it is cloudy today
social post	can you put this on facebook
general dontcare	i would not mind for any one.
play podcasts	move on to the next podcast episode
iot hue lightoff	off lights
lists query	read my lists to me
iot hue lightup	please turn the lights brighter
iot hue lightchange	i need some ambiance please
general commandstop	olly please could you shut up.
cooking recipe	can you prepare a cheese sandwich
audio volume up	could you please yell the answer out to me
email querycontact	what's jesse's birthday
iot hue lightchange	i'd like some red lighting
lists remove	remove the second row from the list
general affirm	yeap you've gotten that correcly.
iot cleaning	initiate the robot vacuum cleaner
audio volume up	i can't hear you speak up
alarm set	please ring the wake up alarm at eight am next saturday
email addcontact	add a new email in my contacts from john
iot hue lightchange	turn living room lights red
social post	bring up a complaint form
news query	what is the headline from today's morning local news
transport traffic	how long should the drive to work take
iot coffee	my coffee is cold please make more coffee
iot cleaning	start irobot
general confirm	can you please check the last thing i said.
email querycontact	what is joe joe's home address
general praise	that's useful, appreciated, olly.
play music	play me all jazz music
play music	play me an upbeat song through your speakers
iot coffee	i would like a cup of coffee
lists remove	get rid of item on the list
iot hue lightchange	can you change the lights to white
recommendation locations	are there any good pizza places around here
email querycontact	is bills house number in my contacts
calendar remove	erase all content in my calendar
audio volume down	it's really loud can you please turn the music down
recommendation locations	can you recommend good stores in this area
transport query	what time does the train arrive
general affirm	got it exactly.
social post	Hashtag loving this weather post to twitter
iot cleaning	clear the dust and then on the cleaner
lists query	anything else left on the list
play radio	turn on one oh seven point five
email querycontact	what is jimmy johns's corporate number
transport query	how do i get to starbucks
music query	who sung this
play music	hi google play me playlist wacky in my gaana application
transport ticket	book a ticket in irctc website from sbc to mdu on may two for stored passenger list
qa currency	what is the currency conversion charges applicable
lists createoradd	please add an item in my calendar
iot wemo off	turn off wemo plug in game room
lists query	open the list
lists createoradd	new list
email query	do i have any new email
social post	tweet i am doing well on twitter
general praise	you are awesome,.
calendar remove	clear my calendar for saturday
social post	tweet my complaint and mention this costumer service
play game	open up tetris
music settings	olly shuffle playlist
general confirm	can you check last thing i said please.
email querycontact	look up in contacts
alarm set	please set my alarm for five pm
qa factoid	just let me know the population of india
email querycontact	what's june's address nowadays
audio volume up	hello beef up the volume a little bit
weather query	how's weather today
alarm set	confirm that the alarm is set for tomorrow
email querycontact	show me derek's contact information
email querycontact	what is my daughter's phone number
iot hue lightup	turn out the lights
news query	dea guam prescription drug abuse on the rise
email addcontact	create new contact
email sendemail	send will do thanks to john as a reply to his last message
play music	can you play call me by aretha franklin after this song is finished playing
recommendation locations	find me the smallest coffee shop in new orleans
alarm set	set alarm tomorrow at six am
calendar set	please remind me for the function at miami tomorrow
transport ticket	can you please book train tickets for two for this friday
play radio	load sirius and play a rock and roll show
email querycontact	tell me john's phone number
qa maths	what is the sum of 9 and 12
email addcontact	add sam@gmail dot com to my contacts list
qa stock	what is now stock price of tata
recommendation locations	where can i get organic wheat
general affirm	yeah correct response to the command.
qa definition	define the moon for me
news query	breaking news fox news
news query	what are the top stories on cnn
audio volume up	speak louder
qa stock	turn on notification for all news on the stock market
general commandstop	would you just cancel it please.
iot hue lightchange	make my lights green
general confirm	would you please check that.
iot hue lightchange	can you do me a favor my eyes are feeling strained on these lights can you please change it to a cooler tone
social query	please give me the latest feed updates
iot hue lightchange	change lights
general commandstop	olly can you cancel please.
general praise	well done, thank you so much.
email querycontact	get me tom's number
iot hue lightoff	shutoff light in the kitchen
general confirm	please can you confirm details.
email query	do i have any mail
transport ticket	help me buy a train ticket to denver for next tuesday morning
email query	please check whether the email of jancy has come
calendar query	make a list of all the halloween events going around in new york
general confirm	check and confirm my last command please.
calendar remove	remove all the events of last month from the calendar
music query	other songs by this artist
audio volume up	raise the volume of the current music
play music	play let me love you by ariana grande
general praise	oh it's great job.
iot hue lightdim	could you dim the lights
lists remove	erase my grocery list
audio volume down	could you please lower your volume
iot wemo on	turn on my wemo socket
iot coffee	please make me coffee without sweetener
social query	has anyone tagged me in a photo on facebook
cooking recipe	how do you zest a lime without a zester
general affirm	that is good.
lists remove	remove noodles from the list
calendar set	set a reminder on fifteenth march as meeting
general commandstop	would you just stop it please.
general dontcare	that is unimportant.
lists query	List all the lists on this device
iot cleaning	can you turn on the vacuum cleaner
calendar set	on february fourteenth make dinner reservations at the restaurant
social query	tell me the exact count of followers on my twitter handle as of today
social post	please tweet the following to radisson hotels customer service
email querycontact	what is job title of jan medvesek
iot wemo off	shut the smart socket down
lists createoradd	open up a new list
calendar remove	i don't want to attend the dinner on march first any more so could you remove it from my agenda
email sendemail	respond to graham and let him know that i will be free tomorrow
iot cleaning	can you set the vacuum to start cleaning at ten am time
lists createoradd	my new work schedule list
iot hue lighton	turn on the lights
transport traffic	how is my commute
general confirm	could you please check what said.
news query	i want to read yahoo news
music query	who is the singer
lists query	what's next on the list
iot hue lightoff	turn house lights off
lists query	give me the shopping list
qa stock	how much does the fb stock cost
general dontcare	have no idea for what to choose.
qa currency	how much is ten u. s. d. to cad
news query	get latest news report on kidnapping in ny
calendar remove	format the calendar
transport traffic	is traffic light
news query	read me the most updated news on bbc
cooking recipe	what ingredients do i need for tomato soup
transport traffic	what is the latest traffic report for miami
qa stock	whats the dow jones at today
play music	play new songs by barenaked ladies
play podcasts	replay my last played podcast
iot wemo on	turn on my plug
general affirm	yes answer was confirmed.
iot cleaning	my vacuum cleaner should start between ten to eleven am everyday
news query	what's happening around the world
iot cleaning	i want to clean my bedroom put the vacuum on and go to my room
audio volume up	raise your volume
email sendemail	inbox my family
qa definition	describe blanket
transport ticket	book me a train ticket to atlanta please
alarm set	set alarm for twelve weeks from today at eight am
play podcasts	play rohan sharma podcast for me
social post	tweet consumer complaint
calendar remove	find dinner with mom on my calendar and delete it
iot hue lightoff	please turn off the lights in the kitchen
cooking recipe	what food is good
qa definition	what does triumph mean
music settings	equalize the bass of this music
lists createoradd	i want to have a new playlist of songs
email query	list new emails
play podcasts	play my favourite podcasts
play podcasts	play anything new from my podcast subscriptions
weather query	tell me weather forecast
qa maths	can you do nine plus two
recommendation locations	where's the closest zoo to where i'm at
email sendemail	pleas reply to the mail of allen
cooking recipe	show me the recipe of tandoori chicken
datetime convert	if it is four pm in missouri what time is it in london
play radio	go to sirius and play the hip hop channel
transport query	when is the next train leaving for austin
general praise	that's useful, thank you very much.
transport ticket	buy me a train ticket
general confirm	did you get my last command correctly?
social query	live show reminders
qa currency	how much is one u. s. d. in inr
transport ticket	i need a train ticket traveling to new york in may
play game	open tic tac toe
music settings	please skip to the next song
general praise	you are so helpful, musch appreciated, olly.
play game	tag you're it
general praise	you have done it correctly musch appreciated, olly.
transport traffic	how is traffic
general commandstop	please will you shut down.
audio volume up	can you turn up the volume
alarm set	wake me up at time
recommendation locations	ask a restaurant in me area
social post	please submit status to facebook
iot cleaning	start cleaning
lists remove	delete item on list
weather query	what was the weather for the week
news query	provide wall street journal news
calendar remove	open calendar and erase all events for all months
qa currency	what's the rate between the u. s. d. and ukraine's currency
iot cleaning	start the robot vacuum cleaner now
play radio	i want to listen some music play a radio station
qa definition	what is the meaning of this word
iot cleaning	vacuum the mud room
transport ticket	fetch me two train tickets for the earliest train to paris
qa currency	how many yen for each dollar
music query	what movie is this song from
music query	what is the title of this song
weather query	status of weather
qa stock	how much did facebook stock increase last night
play podcasts	can you play the next podcast
recommendation locations	what restaurants are open near me
social query	tell me what's happening on instagram
qa factoid	how old is betty white
lists createoradd	a new list to be created by tomorrow
iot hue lightchange	change my room lights so that i can get a good sleep
qa factoid	who was john dillinger
calendar set	set a reminder for my shopping trip tomorrow at five pm
transport ticket	please book train ticket to new york
general confirm	please can you confirm it.
lists query	what are the jobs to be done today
iot hue lightoff	please turn off the lights in this room
music query	who wrote the song that is playing
qa factoid	how many bones does a human body have
qa stock	how much to buy stock in i. b. m.
calendar query	meeting july calendar
email query	what are the subject line and sender from today's email inbox
qa maths	are you solve my math
qa stock	when does iphone stock usually drop
news query	can you give me the latest sports news
calendar set	remind me about my anniversary in one day advance
social query	please check the news on social media
play radio	play howard stern on sirius
calendar set	remind me of my twelve oclock meeting by eleven thirty
recommendation locations	when does the closest bar close
email query	what new messages do i have
play radio	the radio should play only on nine hundred and ninety nine fm
social post	place family phone on instagram
cooking recipe	how many millilitres is two table spoons
play music	let me hear some music
lists remove	delete the shopping list
calendar query	tell me if there are any events from three to five
play music	initiate the music on the electronic playlist
recommendation locations	tell me pizza restaurants close by
transport query	can you look up train ticket prices for me
email querycontact	tell me about mary s. in my contacts
general confirm	could you please confirm the instruction.
iot coffee	make coffee
music query	this song is composed by whom
general dontcare	would not mind for any one.
iot cleaning	company coming over turn on the vacuum cleaner right now
lists query	what list do i have
lists remove	i need you to remove item s from my list
social query	is there anything new on reddit
iot hue lightdim	nighttime mode
audio volume up	could you speak louder
email query	do i have any new email from ryan
lists remove	please remove list
general affirm	yeap you have got my instructions correcly.
news query	google search the topic
social query	show me my husbands facebook posts today
qa factoid	what is hair made up of
calendar set	can you remind me about the gym class in two hours
play radio	start my playlist on i heart radio
music query	who is the song writer
transport ticket	i need a train ticket to
general affirm	yes you've done command exactly.
iot hue lightchange	change the lights to green
play game	play checkers with me
general dontcare	this doesn't really matter to me.
lists remove	please remove the grocery list from my set of lists
play music	coordinate all pop song genres
iot hue lightchange	change the lights into green
general praise	you are smart, olly.
qa stock	tell me about price of stock for innova
play music	open my amazon music app and play my playlist
transport traffic	what's the traffic on eighty today
social post	tweet verizon customer service
iot cleaning	go near vacuum cleaner
general praise	appreciated, that is great job.
play game	bring up papa pear saga
social post	tweet at quote unquote
email addcontact	add sarah as email contact
transport ticket	buy train ticket
lists createoradd	create new list
qa currency	what is the exchange rate for the english pound and us dollar
email query	how many emails today
iot hue lightoff	shift the balcony light to off
lists remove	cancel list
datetime convert	if it's midnight in colorado what time is it in munich
email sendemail	email my boss that i will be late today because of an emergency and apologize to him for missing the meeting
audio volume up	turn the volume up
iot hue lightoff	turn off the bathroom light
qa stock	how expensive is google stock
social post	post this to my facebook lol
general dontcare	i do not know.
iot hue lightup	connect to lights
email query	are there any new emails from robert jones
transport traffic	is there any traffic on my way to work
iot hue lightoff	turn off the living room lights
iot cleaning	activate robot vacuum cleaner
general dontcare	anything is okay with me.
datetime convert	please can i know what time will it be at six pm here in australia
email sendemail	send an email to fred from work he is in my contacts
iot hue lightup	its dark in here mind turning up the light intensity
email query	what are my newest emails
transport traffic	is there any traffic downtown right now
iot hue lightdim	lower brightness of lights
qa factoid	show me the demographic growth rate of switzerland in the last ten years
lists remove	please clean my shopping list
transport ticket	buy a train ticket from lakeland florida to new york
general dontcare	i don't really care.
email query	is the mail from chris about work
iot coffee	i need coffee please preferably hot
iot hue lightoff	turn off the lights
news query	i need sport's news
play podcasts	next episode in the podcast please
transport traffic	how is traffic on the highway
social query	is there anything exciting on twitter today
iot hue lightup	please turn up the light a little
transport traffic	are there any accidents on my way to work
alarm set	wake me up at five hundred and thirty
lists query	read list for me please
alarm set	please we're the following alarm
audio volume up	speak louder please
qa stock	compare the stock prices for nintendo and sony and tell me which ones are better
qa currency	is the exchange rate changed from yesterday
iot hue lightup	raise the lamp's light
weather query	how hot is it outside today
iot hue lightoff	turn the living rooms lights off
qa currency	what is the exchange between dollar and british pound
qa definition	give me the description of a smartphone circuit
play game	let's play nine ball against me adapt with my skill level always let me win
email sendemail	email my favourite contacts
email sendemail	tell to joe's email that come to my house in this moment i am alone
transport traffic	what is traffic
qa currency	how much indian rupees per u. s. d. today
general dontcare	don't really care.
iot hue lightchange	turn the lights to red color
audio volume up	i can't hear you can you say it again louder
audio volume up	i need you to have the volume louder
play music	play music from where you left off
play game	let's play chess
email query	pull up all emails sent to me from amazon
lists query	what do i need to complete first from the list
general confirm	check detail please.
qa currency	tell me the exchange rate us versus indian rupees
datetime convert	what's the time difference between here and queensland
iot hue lightup	more bright
music query	in classic all music are there ever any singers
iot wemo on	turn on the tv socket when i arrive home
general affirm	excellent.
lists remove	i don't have enough money to buy the nintendo switch right now can you please remove it on my amazon wishlist
qa factoid	what johncena do
iot hue lightdim	lower the lighting
play podcasts	start playlist for podcast
audio volume up	turn the volume up on music player
email query	would you go check my emails for me
general affirm	yes it was perfect.
play music	please play workout playlist
email querycontact	will you look up joe's contact information for me
transport query	how to get somewhere
iot hue lightoff	turn off the lights please
qa currency	exchange rate between dollar and mexican peso
alarm set	please set an alarm at seven am tomorrow morning
datetime convert	what is the time difference between central and eastern
recommendation locations	i wish to go for cheap shopping is there any dollars shop nearby
social post	customer service from microsoft never called me back
lists createoradd	make a new list for school supplies
play game	play candy crush with me
iot hue lightoff	can you turn off one of my lights in my bathroom
qa stock	stock price fb
play music	please resume my music
cooking recipe	crockpot recipe for chicken alfredo
transport query	tell me the trains from california to new jersey after eleven pm
music query	what genre is most played on my music player
weather query	what's the current temperature outside
transport ticket	reserve a seat for me on the train march twentieth
weather query	what is the weather going to be like on march twentieth two thousand and seventeen
qa maths	what is twelve times eight
qa definition	what does a beech tree look like
general commandstop	olly that is enough, cancel.
transport ticket	confirm a railway reservation ticket to california
calendar set	on every tuesday remind me to go shopping
general praise	excellent work, you've done well.
qa maths	what is two times two
play game	start angry bird
email querycontact	can i find out information about a contact
play game	would you like to play never have i ever
email sendemail	send an email with the address you gave me to jean saying meet us here at eight pm
general praise	it's helpful, thank you.
play game	open up angry birds
recommendation locations	where is the closest kroger
social query	what was the last thing my mom said
general commandstop	that is all, just stop.
general confirm	did you get the instruction correctly?
play radio	tune to pandora
social post	tell my facebook group that i've arrived
play music	play music from workout playlist
play music	play jingle bells
email sendemail	write this message to the coworker group
iot cleaning	turn on the vacuum now
weather query	google what is the temperature outside
email addcontact	save this email in contact
recommendation locations	where is a theatre in my area
general confirm	can you please check what i last said.
lists createoradd	remember to put carrots in there
iot cleaning	clean the flat
transport traffic	what does the traffic look like on my usual route to work
iot hue lightup	add light
qa definition	please tell me what a crankshaft is
weather query	temperature this hour
general praise	you are smart.
audio volume down	slow down the speaker volume
general affirm	yes you have done it exactly.
